|title|subreddit_subscribers|num_comments|create_date|new_date|new_time
0|Official Q&amp;A for Saturday, November 04, 2023|2684021|90|2023-11-04 04:01:11|2023-11-04|04:01:11
1|That Frigid Season is Here! - Annual cold / cool / winter weather running and gear thread|2684021|215|2023-10-31 14:11:22|2023-10-31|14:11:22
2|Super shoes have ‘blown distance running into a new stratosphere.’ Are they benefitting the sport?|2684021|120|2023-11-04 13:05:18|2023-11-04|13:05:18
3|What cool things do you with your medals? The ones we've got in that huge basket just sitting?|2684021|61|2023-11-04 14:24:33|2023-11-04|14:24:33
4|What marathon training plan would you recommend?|2684021|12|2023-11-04 17:48:33|2023-11-04|17:48:33
5|This 12-year-old runner broke a world record. But competition isn’t the only thing she’s up against|2684021|114|2023-11-03 13:06:48|2023-11-03|13:06:48
6|Kelvin Kiptum to run the Rotterdam Marathon on April 14 2024|2684021|32|2023-11-03 15:55:18|2023-11-03|15:55:18
7|Achievements for Saturday, November 04, 2023|2684021|40|2023-11-04 04:01:12|2023-11-04|04:01:12
8|How intense do you go in your strength sessions, given your goals are different to someone whose main modality is lifting?|2684021|66|2023-11-03 14:52:48|2023-11-03|14:52:48
9|Indianapolis Monumental Marathon Race Report|2684021|5|2023-11-03 18:25:41|2023-11-03|18:25:41
10|Social Saturday|2684021|1|2023-11-04 04:01:10|2023-11-04|04:01:10
11|Thoughts on hiring run coach?|2684021|6|2023-11-03 22:18:15|2023-11-03|22:18:15
12|Indianapolis Monumental 2023: so close yet so far|2684021|5|2023-11-03 17:32:36|2023-11-03|17:32:36
13|What's your favorite DIY recipe for making sports gels, bars, or isotonic drinks at home, and what are the key ingredients you use?|2684021|10|2023-11-03 22:23:31|2023-11-03|22:23:31
14|Do you guys run with or without music and why?|2684021|1188|2023-11-02 20:09:47|2023-11-02|20:09:47
15|I failed my first ultramarathon, and I have never been so happy.|2684021|139|2023-11-02 17:05:05|2023-11-02|17:05:05
16|The Weekend Thread — 3rd November 2023|2684021|59|2023-11-03 12:31:29|2023-11-03|12:31:29
17|Best winter half’s in Florida?|2684021|7|2023-11-03 20:56:08|2023-11-03|20:56:08
18|Best video camera for running?|2684021|44|2023-11-02 18:49:23|2023-11-02|18:49:23
19|How to know when to give up your shoes?|2684021|92|2023-11-02 20:17:26|2023-11-02|20:17:26
20|It's Photo Friday - let's see your running pictures!|2684021|9|2023-11-03 12:53:37|2023-11-03|12:53:37
21|Arch support aside from full insole|2684021|2|2023-11-03 17:51:47|2023-11-03|17:51:47
22|Race Roll Call|2684021|33|2023-11-03 04:01:20|2023-11-03|04:01:20
23|Official Q&amp;A for Friday, November 03, 2023|2684021|231|2023-11-03 04:01:09|2023-11-03|04:01:09
24|Marine Corps Marathon 2023 - Hot and Hilly|2684021|11|2023-11-02 16:52:26|2023-11-02|16:52:26
25|Not the day I hope for on my first Marathon - Dublin City Marathon|2684021|61|2023-11-02 11:42:01|2023-11-02|11:42:01
26|Regular wireless earbuds like the Bose Soundsports?|2684021|18|2023-11-02 21:47:51|2023-11-02|21:47:51
27|Achievements for Friday, November 03, 2023|2684022|6|2023-11-03 04:01:11|2023-11-03|04:01:11
28|I was hesitant to post this, but: First Marathon Report (MCM 2023)|2684022|39|2023-11-02 01:45:25|2023-11-02|01:45:25
29|Shoe insole question? Are you all using the stock insoles? (PF, SuperFeet)|2684022|9|2023-11-03 02:49:31|2023-11-03|02:49:31
30|Weekly Complaints &amp; Confessions Thread|2684022|132|2023-11-02 12:24:32|2023-11-02|12:24:32
31|Daniel's Running Formula Edition Differences|2684022|2|2023-11-02 21:24:10|2023-11-02|21:24:10
32|Auckland Half Marathon 2023 - 15 min off PB, Wind and Hills|2684022|7|2023-11-02 07:49:26|2023-11-02|07:49:26
33|What do you do with old running shoes? Any good recycling options?|2684022|30|2023-11-02 02:30:42|2023-11-02|02:30:42
34|Achievements for Thursday, November 02, 2023|2684022|41|2023-11-02 04:01:10|2023-11-02|04:01:10
35|Official Q&amp;A for Thursday, November 02, 2023|2684022|150|2023-11-02 04:01:09|2023-11-02|04:01:09
36|How to train for loop race?|2684022|61|2023-11-01 14:03:50|2023-11-01|14:03:50
37|Suggestions to run better with naturally hyperextended knees ?|2684022|8|2023-11-02 07:47:48|2023-11-02|07:47:48
38|Race Report: First Half Marathon in Auckland!|2684022|2|2023-11-01 09:34:04|2023-11-01|09:34:04
39|Best Spring HM? US only.|2684022|25|2023-11-01 21:56:19|2023-11-01|21:56:19
40|No plan survives first contact with my body - Dublin Marathon|2684022|14|2023-10-31 20:18:16|2023-10-31|20:18:16
41|My first Marathon - Marine Corps Marathon 2023|2684022|15|2023-10-31 21:02:13|2023-10-31|21:02:13
42|Achievements for Wednesday, November 01, 2023|2684022|31|2023-11-01 04:01:12|2023-11-01|04:01:12
43|Lurkers' Wednesday|2684022|19|2023-11-01 04:01:10|2023-11-01|04:01:10
44|October Monthly Updates &amp; Check In Thread|2684022|19|2023-11-01 05:01:25|2023-11-01|05:01:25
45|Official Q&amp;A for Wednesday, November 01, 2023|2684022|143|2023-11-01 04:01:11|2023-11-01|04:01:11
46|Best road 50k's?|2684022|25|2023-10-31 19:18:16|2023-10-31|19:18:16
47|Late night runners, what spooky things have you seen?|2684022|328|2023-10-31 04:30:53|2023-10-31|04:30:53
48|Earbuds|2684022|150|2023-10-31 14:07:23|2023-10-31|14:07:23
49|What to give runners at mile 18 of a marathon?|2684022|730|2023-10-31 00:14:31|2023-10-31|00:14:31
50|Race Report: First Marathon|2684022|3|2023-10-31 19:10:54|2023-10-31|19:10:54
51|Indy Monumental Marathon - Doing all the new things on race day|2684022|8|2023-10-31 15:11:00|2023-10-31|15:11:00
52|Run with plantar fascitis?|2684022|69|2023-10-31 14:22:07|2023-10-31|14:22:07
53|What Are You Wearing Wednesday - Weekly Gear Thread|2684022|5|2023-11-01 04:01:11|2023-11-01|04:01:11
54|Inkkas running shoes?|2684022|4|2023-11-01 00:54:36|2023-11-01|00:54:36
55|Race Report: Indianapolis Monumental Marathon|2684022|6|2023-10-31 13:53:45|2023-10-31|13:53:45
56|Looking for leggings that are made of thinner fabric than most out there|2684022|15|2023-10-31 21:45:58|2023-10-31|21:45:58
57|MCM - it was great until it wasn’t|2684022|29|2023-10-31 03:09:38|2023-10-31|03:09:38
58|A monumental 26.15 (and rough 0.05)|2684022|21|2023-10-31 01:06:36|2023-10-31|01:06:36
59|Running a first marathon with a major jet lag - not a good idea|2684022|14|2023-10-31 00:37:33|2023-10-31|00:37:33
60|“Why are you so slow?”|2684022|55|2023-10-30 12:59:51|2023-10-30|12:59:51
61|Dublin Marathon - learning to respect the distance|2684022|9|2023-10-30 22:35:37|2023-10-30|22:35:37
62|Super Moronic Monday - Your Weekly Tuesday Stupid Questions Thread|2684022|76|2023-10-31 11:17:21|2023-10-31|11:17:21
63|Tuesday Shoesday|2684022|10|2023-10-31 04:01:08|2023-10-31|04:01:08
64|Achievements for Tuesday, October 31, 2023|2684022|32|2023-10-31 04:01:09|2023-10-31|04:01:09
65|"PRI, stride analysis, ""Hruska"" shoe list, tibular torsion"|2684022|1|2023-10-31 13:36:28|2023-10-31|13:36:28
66|Marathon pre-run present|2684022|77|2023-10-30 14:00:53|2023-10-30|14:00:53
67|Official Q&amp;A for Tuesday, October 31, 2023|2684022|129|2023-10-31 04:01:09|2023-10-31|04:01:09
68|Suffolk Half Marathon less than 10 months after breaking my tibia|2684022|12|2023-10-30 18:06:54|2023-10-30|18:06:54
69|Big Easy Halloween 5k|2684022|13|2023-10-30 13:41:34|2023-10-30|13:41:34
70|Run Nutrition Tuesday|2684022|0|2023-10-31 04:01:08|2023-10-31|04:01:08
71|Post MCM thread|2684022|87|2023-10-30 13:57:46|2023-10-30|13:57:46
72|Marine Corp Marathon - First Road Marathon|2684022|25|2023-10-30 13:38:04|2023-10-30|13:38:04
73|Thoughts/Opinions on Vermont City Marathon?|2684022|13|2023-10-30 22:07:39|2023-10-30|22:07:39
74|First Half Marathon|2684022|5|2023-10-30 17:59:35|2023-10-30|17:59:35
75|How long does it take to assimilate to trail running when transitioning from road?|2684022|10|2023-10-30 21:28:11|2023-10-30|21:28:11
76|Miscellaneous Monday Chit Chat|2684022|64|2023-10-30 12:01:10|2023-10-30|12:01:10
77|Does anyone participate in the Conquerer Challenges?|2684021|1|2023-10-30 21:54:06|2023-10-30|21:54:06
78|Voice-guided navigation for cheapskates|2684021|1|2023-10-30 21:36:30|2023-10-30|21:36:30
79|"Auckland Marathon | First marathon and it's all fun and games until you get hit in the face with cow turd."|2684021|5|2023-10-30 02:55:44|2023-10-30|02:55:44
80|Achievements for Monday, October 30, 2023|2684021|49|2023-10-30 04:01:12|2023-10-30|04:01:12
81|Official Q&amp;A for Monday, October 30, 2023|2684021|150|2023-10-30 04:01:11|2023-10-30|04:01:11
82|First half marathon, 22 October 2023|2684021|6|2023-10-29 17:37:52|2023-10-29|17:37:52
83|Li'l Race Report Thread|2684021|5|2023-10-30 04:01:10|2023-10-30|04:01:10
84|Couch to Half Marathon|2684021|11|2023-10-29 09:25:01|2023-10-29|09:25:01
85|Halloween Haunting (London, Ontario|2684021|1|2023-10-29 17:58:11|2023-10-29|17:58:11
86|Gluten free carb loading|2684021|13|2023-10-29 20:45:56|2023-10-29|20:45:56
87|Achievements for Sunday, October 29, 2023|2684021|130|2023-10-29 04:01:11|2023-10-29|04:01:11
88|The Weekly Training Thread|2684021|16|2023-10-29 04:01:10|2023-10-29|04:01:10
89|second attempt at the Big Half|2684021|4|2023-10-28 20:51:19|2023-10-28|20:51:19
90|Edinburgh Women's 10km|2684021|7|2023-10-28 14:53:31|2023-10-28|14:53:31
91|Official Q&amp;A for Sunday, October 29, 2023|2684021|153|2023-10-29 04:01:11|2023-10-29|04:01:11
92|Achievements for Saturday, October 28, 2023|2684021|102|2023-10-28 04:01:10|2023-10-28|04:01:10
93|Norway’s fastest – and most famous – running family is ripped apart by allegations of ‘aggression and physical punishment’|2684021|45|2023-10-27 13:14:54|2023-10-27|13:14:54
94|Official Q&amp;A for Saturday, October 28, 2023|2684021|63|2023-10-28 04:01:10|2023-10-28|04:01:10
95|Advice for a career in coaching|2684021|5|2023-10-28 01:37:21|2023-10-28|01:37:21
97|The Weekend Thread — 27th October 2023|2684021|107|2023-10-27 12:25:36|2023-10-27|12:25:36
99|Discrepancies with Chicago Marathon Splits: Kelvin Kiptum’s 4:18 Mile Split at 2023 Chicago Marathon Was Too Good to Be True|2684021|34|2023-10-27 00:25:00|2023-10-27|00:25:00
101|Achievements for Friday, October 27, 2023|2684021|9|2023-10-27 04:01:10|2023-10-27|04:01:10
102|Official Q&amp;A for Friday, October 27, 2023|2684023|156|2023-10-27 04:01:09|2023-10-27|04:01:09
103|First Marathon @Antwerp|2684023|4|2023-10-26 15:53:42|2023-10-26|15:53:42
105|Big's Backyard Ultra - Update (race in progress)|2684023|38|2023-10-25 19:05:15|2023-10-25|19:05:15
106|Achievements for Thursday, October 26, 2023|2684023|38|2023-10-26 04:01:10|2023-10-26|04:01:10
107|Official Q&amp;A for Thursday, October 26, 2023|2684023|171|2023-10-26 04:01:09|2023-10-26|04:01:09
108|Getting out of a Running Rut?|2684023|16|2023-10-25 20:46:20|2023-10-25|20:46:20
109|First Marathon- Way too detailed Race Report.|2684023|38|2023-10-25 03:20:54|2023-10-25|03:20:54
110|Indianapolis Marathon - Where to Spectate?|2684023|2|2023-10-25 21:31:32|2023-10-25|21:31:32
111|Best running socks ever|2684023|1|2023-10-26 02:31:21|2023-10-26|02:31:21
112|Playa del Carmen|2684023|6|2023-10-26 02:30:34|2023-10-26|02:30:34
113|Running Reset|2684023|5|2023-10-25 17:17:28|2023-10-25|17:17:28
114|Official Q&amp;A for Wednesday, October 25, 2023|2684023|180|2023-10-25 04:01:10|2023-10-25|04:01:10
115|Achievements for Wednesday, October 25, 2023|2684023|24|2023-10-25 04:01:10|2023-10-25|04:01:10
116|Race Report: Toronto Waterfront Marathon|2684023|3|2023-10-24 21:22:33|2023-10-24|21:22:33
117|Antwerp Marathon - First Marathon - Love-hate relationship with suffering|2684023|17|2023-10-24 19:47:18|2023-10-24|19:47:18
119|Bone conducting headphones for running - Philips or Shokz?|2684023|101|2023-10-24 19:05:05|2023-10-24|19:05:05
121|What're the worst conditions you've ever raced in?|2684023|341|2023-10-24 08:03:44|2023-10-24|08:03:44
122|What are the best things your support person can have and do for you during your marathon?|2684023|152|2023-10-23 22:07:47|2023-10-23|22:07:47
123|Return to the Superhalf Series at Valencia Half Marathon|2684023|1|2023-10-24 07:37:01|2023-10-24|07:37:01
126|Have you traveled internationally for a marathon?|2684023|82|2023-10-23 16:12:44|2023-10-23|16:12:44
127|Columbia Gorge Half Marathon|2684022|14|2023-10-23 22:40:17|2023-10-23|22:40:17
129|Official Q&amp;A for Tuesday, October 24, 2023|2684022|152|2023-10-24 04:01:09|2023-10-24|04:01:09
130|Atlanta PNC 10 Miler (New Runner)|2684022|7|2023-10-23 18:18:30|2023-10-23|18:18:30
131|Achievements for Tuesday, October 24, 2023|2684022|14|2023-10-24 04:01:10|2023-10-24|04:01:10
132|Spring Races for 1 Mile PR?|2684022|5|2023-10-24 02:40:48|2023-10-24|02:40:48
133|Audio Book on Training for an Ultra Marathon|2684022|4|2023-10-23 20:44:55|2023-10-23|20:44:55
134|Total Energies Bilbao Night Marathon|2684022|9|2023-10-23 15:15:27|2023-10-23|15:15:27
136|Looking for a West Coast marathon|2684022|17|2023-10-23 13:52:55|2023-10-23|13:52:55
137|Race Report: The Jakarta Marathon. Hot, humid, smoggy hell.|2684022|28|2023-10-22 11:55:39|2023-10-22|11:55:39
138|Race Report: Antwerp (Half) Marathon 2023 / 1:33:21|2684022|5|2023-10-22 22:55:06|2023-10-22|22:55:06
139|TCS Toronto Waterfront Half Marathon|2684022|6|2023-10-22 19:27:32|2023-10-22|19:27:32
140|Achievements for Monday, October 23, 2023|2684022|38|2023-10-23 04:01:14|2023-10-23|04:01:14
141|Low mileage marathon success in Kansas City|2684022|18|2023-10-22 14:18:28|2023-10-22|14:18:28
142|Official Q&amp;A for Monday, October 23, 2023|2684022|272|2023-10-23 04:01:13|2023-10-23|04:01:13
143|best half marathons in Sacramento|2684022|9|2023-10-22 23:14:26|2023-10-22|23:14:26
145|Achievements for Sunday, October 22, 2023|2684022|107|2023-10-22 04:01:10|2023-10-22|04:01:10
146|2023 Purdue Half Marathon Race Report|2684022|14|2023-10-21 18:44:25|2023-10-21|18:44:25
147|Official Q&amp;A for Sunday, October 22, 2023|2684022|145|2023-10-22 04:01:10|2023-10-22|04:01:10
149|Backyard Ultra World Championship Livestream on Youtube|2684022|12|2023-10-21 18:40:30|2023-10-21|18:40:30
150|Stroller Running - Thule Glide 1 vs Glide 2|2684022|4|2023-10-22 06:04:16|2023-10-22|06:04:16
151|Why do you think the Half Marathon is a less popular event at the Elite level?|2684022|123|2023-10-20 22:19:15|2023-10-20|22:19:15
152|WOMEN'S hydration vests for running without a shirt?|2684023|50|2023-10-21 04:42:25|2023-10-21|04:42:25
153|Twin Cities Marathon - Refunds Participants with Gauranteed Spots for TCM 24'|2684023|13|2023-10-20 21:45:37|2023-10-20|21:45:37
154|2023 Chicago Marathon Race Report|2684023|23|2023-10-20 21:07:38|2023-10-20|21:07:38
155|Achievements for Saturday, October 21, 2023|2684023|74|2023-10-21 04:01:10|2023-10-21|04:01:10
156|organizing a 5k for my kids school|2684023|16|2023-10-20 23:53:26|2023-10-20|23:53:26
157|Official Q&amp;A for Saturday, October 21, 2023|2684023|155|2023-10-21 04:01:09|2023-10-21|04:01:09
159|Superstitions day before race|2684023|105|2023-10-20 12:38:47|2023-10-20|12:38:47
160|Data Analysis Paralysis|2684023|11|2023-10-20 20:14:25|2023-10-20|20:14:25
162|Copenhagen Marathon 2024|2684023|7|2023-10-20 18:54:43|2023-10-20|18:54:43
163|The Weekend Thread — 20th October 2023|2684023|92|2023-10-20 12:52:30|2023-10-20|12:52:30
164|App that uses garmin or google location history to generate heatmaps?|2684023|7|2023-10-20 15:12:50|2023-10-20|15:12:50
165|Toronto Waterfront Half Marathon 2023: My first race in 7 years (dedicated to the 2 hour pacer, my MVP)|2684023|14|2023-10-19 21:04:05|2023-10-19|21:04:05
166|Race Report: Melbourne Half Marathon - My First Ever Race, and Conquering a Curvy Spine|2684023|6|2023-10-20 04:16:18|2023-10-20|04:16:18
167|Volunteering - what is normal and what isn’t?|2684023|24|2023-10-20 02:36:59|2023-10-20|02:36:59
168|Amsterdam Half-Marathon -|2684023|1|2023-10-19 20:45:45|2023-10-19|20:45:45
169|Toronto Waterfront, First 42.2!|2684023|6|2023-10-19 19:24:24|2023-10-19|19:24:24
171|Official Q&amp;A for Friday, October 20, 2023|2684023|143|2023-10-20 04:01:09|2023-10-20|04:01:09
172|Trondheim half marathon, my first race|2684023|13|2023-10-19 13:45:02|2023-10-19|13:45:02
173|Achievements for Friday, October 20, 2023|2684023|14|2023-10-20 04:01:10|2023-10-20|04:01:10
175|Race Report: Toronto Waterfront Half Marathon - Slow and Steady and FUN!|2684023|19|2023-10-18 19:51:13|2023-10-18|19:51:13
176|Tacked on a new goal during the Toronto Waterfront Half (sub 1:45) - and beat it!|2684023|13|2023-10-18 23:33:59|2023-10-18|23:33:59
177|A PB (1:44:58) at the Toronto Waterfront Marathon!|2684023|19|2023-10-18 17:11:37|2023-10-18|17:11:37
178|Detroit Freep Marathon|2684023|15|2023-10-18 23:20:19|2023-10-18|23:20:19
179|Managing suboptimal racing weather|2684023|40|2023-10-19 01:54:46|2023-10-19|01:54:46
180|First Race Ever in the History of My Life - Amsterdam Half Marathon|2684023|6|2023-10-18 23:06:00|2023-10-18|23:06:00
181|Official Q&amp;A for Thursday, October 19, 2023|2684023|183|2023-10-19 04:01:16|2023-10-19|04:01:16
182|Achievements for Thursday, October 19, 2023|2684023|17|2023-10-19 04:01:16|2023-10-19|04:01:16
183|Halloween half marathon costume suggestions?|2684023|60|2023-10-18 12:32:37|2023-10-18|12:32:37
184|Race Report: Amsterdam Marathon - biblical conditions but a PB in the bag|2684023|2|2023-10-18 10:16:28|2023-10-18|10:16:28
185|Best marathon in the winter in southwest US?|2684023|79|2023-10-18 12:36:38|2023-10-18|12:36:38
186|Running first marathon locally or traveling?|2684023|112|2023-10-17 20:23:19|2023-10-17|20:23:19
187|Chicago Marathon 2024 registration is open now|2684023|133|2023-10-17 15:27:00|2023-10-17|15:27:00
188|C25K for an octogenarian?|2684023|26|2023-10-18 02:58:29|2023-10-18|02:58:29
190|Achievements for Wednesday, October 18, 2023|2684023|32|2023-10-18 04:01:13|2023-10-18|04:01:13
191|Official Q&amp;A for Wednesday, October 18, 2023|2684023|205|2023-10-18 04:01:12|2023-10-18|04:01:12
192|My 2nd Marathon - Time for redemption|2684023|7|2023-10-17 20:21:29|2023-10-17|20:21:29
194|First Half Marathon! TCS Toronto Waterfront 2023|2684023|28|2023-10-17 14:49:30|2023-10-17|14:49:30
195|7 Bridges Marathon|2684023|20|2023-10-17 15:02:54|2023-10-17|15:02:54
196|Best running stores in Sydney|2684023|3|2023-10-18 03:53:45|2023-10-18|03:53:45
197|Family friendly and spectator fun marathons/half marathons|2684023|18|2023-10-17 22:45:34|2023-10-17|22:45:34
198|Race Report: Nike Melbourne Marathon - my first marathon and finding out about cramps|2684023|19|2023-10-17 04:30:55|2023-10-17|04:30:55
200|Melbourne Marathon – My First Marathon|2684023|39|2023-10-16 23:00:34|2023-10-16|23:00:34
201|Atl10miler|2684023|7|2023-10-17 21:49:06|2023-10-17|21:49:06
202|Columbus Marathon - My First Marathon! Fantastic Race with Outstanding Support|2684023|20|2023-10-17 01:22:56|2023-10-17|01:22:56
203|Race Report: Amsterdam Marathon. Sub 2:40 marathon, 17 minute PR in one year!|2684023|4|2023-10-17 00:18:47|2023-10-17|00:18:47
204|TCS Toronto Waterfront Marathon (Full) 2023 Race Report|2684023|18|2023-10-17 00:00:41|2023-10-17|00:00:41
205|Hartford Marathon Race Report: PR coming off an 8 year hiatus|2684023|3|2023-10-17 01:24:19|2023-10-17|01:24:19
206|First Half Marathon! - Toronto Waterfront - Race Report|2684023|27|2023-10-16 21:01:32|2023-10-16|21:01:32
207|Official Q&amp;A for Tuesday, October 17, 2023|2684023|213|2023-10-17 04:01:11|2023-10-17|04:01:11
208|"Baystate Marathon Race Report: A ""BQ"" and a 40 minute PR"|2684023|25|2023-10-16 13:59:08|2023-10-16|13:59:08
209|Achievements for Tuesday, October 17, 2023|2684023|36|2023-10-17 04:01:11|2023-10-17|04:01:11
210|Baystate Marathon (Full) Race Report- How to Achieve No Goals and Bonk Completely|2684023|26|2023-10-16 14:25:07|2023-10-16|14:25:07
212|Detroit Free Press International Half-Marathon: A cool and fast race|2684023|7|2023-10-16 15:45:04|2023-10-16|15:45:04
214|First marathon (Amsterdam) report|2684023|32|2023-10-16 11:53:38|2023-10-16|11:53:38
215|TCS Toronto Waterfront Marathon - An Embarrassing First Marathon|2684023|7|2023-10-16 16:14:47|2023-10-16|16:14:47
216|Chattanooga 7 Bridges Marathon race Report|2684023|7|2023-10-16 17:09:48|2023-10-16|17:09:48
217|First Marathon Yesterday in Yorkshire|2684023|15|2023-10-16 16:18:13|2023-10-16|16:18:13
218|Bucharest Marathon - my first of many!|2684023|10|2023-10-16 13:39:45|2023-10-16|13:39:45
219|My First Half-Marathon - Detroit Free Press Marathon|2684023|8|2023-10-16 13:16:14|2023-10-16|13:16:14
220|Loop the Lake Half Marathon - Race Report|2684023|5|2023-10-16 21:01:49|2023-10-16|21:01:49
221|Race report: Oxford Half|2684023|5|2023-10-16 20:15:52|2023-10-16|20:15:52
222|Great South Run 2023 - Race Report|2684023|1|2023-10-16 17:05:16|2023-10-16|17:05:16
223|Race Report: Detroit Free Press International Half Marathon|2684023|7|2023-10-16 12:48:34|2023-10-16|12:48:34
225|Oxford Half Marathon Race Report - First Half Marathon and Couldn't Ask For Better Conditions|2684023|5|2023-10-16 09:39:40|2023-10-16|09:39:40
226|Melbourne Marathon (full) - Race Report|2684023|16|2023-10-16 04:42:58|2023-10-16|04:42:58
227|Race Report: Detroit Free Press Marathon - my first HM!|2684023|18|2023-10-16 03:58:05|2023-10-16|03:58:05
228|Race Report: Chelmsford HM - My first ever HM and 2nd only running event|2684023|6|2023-10-16 14:18:26|2023-10-16|14:18:26
229|Official Q&amp;A for Monday, October 16, 2023|2684023|250|2023-10-16 04:01:14|2023-10-16|04:01:14
230|Achievements for Monday, October 16, 2023|2684023|63|2023-10-16 04:01:14|2023-10-16|04:01:14
231|Oxford Half Marathon Race Report|2684023|21|2023-10-15 16:42:02|2023-10-15|16:42:02
232|Looking for ideas on running progress board.|2684023|4|2023-10-16 09:42:02|2023-10-16|09:42:02
233|Lake Powell Half Marathon &amp; First Half Marathon|2684023|2|2023-10-16 05:37:51|2023-10-16|05:37:51
235|First 1/2 Marathon|2684023|33|2023-10-15 10:50:30|2023-10-15|10:50:30
236|Great Bruges Half Marathon Race report|2684023|1|2023-10-16 09:00:01|2023-10-16|09:00:01
237|EnduranceLife Suffolk Half Marathon Race Report 2023|2684023|4|2023-10-15 19:51:40|2023-10-15|19:51:40
238|Hands-free home massage device? (not foam roller)|2684023|11|2023-10-15 17:39:31|2023-10-15|17:39:31
239|Sunset &amp; Cider Trail 5mi Race Report|2684023|1|2023-10-15 23:04:12|2023-10-15|23:04:12
240|Achievements for Sunday, October 15, 2023|2684023|186|2023-10-15 04:01:13|2023-10-15|04:01:13
241|Mississauga marathon returning in 2024|2684023|31|2023-10-14 20:35:05|2023-10-14|20:35:05
242|Official Q&amp;A for Sunday, October 15, 2023|2684023|123|2023-10-15 04:01:12|2023-10-15|04:01:12
244|Cold hands|2684023|64|2023-10-14 19:34:41|2023-10-14|19:34:41
245|Any tips for starting trail running?|2684023|62|2023-10-14 12:06:17|2023-10-14|12:06:17
246|Are there any good books or resources for teens getting into running? (nutrition, physiology, etc.)|2684023|49|2023-10-14 15:00:41|2023-10-14|15:00:41
247|"Over Commercialization of ""Influencer Running"""|2684023|282|2023-10-13 22:45:45|2023-10-13|22:45:45
248|Cincinnati Queen Bee - First Half Marathon|2684023|16|2023-10-14 16:51:25|2023-10-14|16:51:25
249|One for the running data nerds|2684023|19|2023-10-14 03:35:35|2023-10-14|03:35:35
250|Chicago Marathon Race Report: Another First Timer Learns a Familiar Lesson|2684023|40|2023-10-13 16:14:14|2023-10-13|16:14:14
251|Wild 'Fire Run' Adventure: A Race Full of Surprises and Setbacks|2684023|1|2023-10-14 17:02:08|2023-10-14|17:02:08
252|Achievements for Saturday, October 14, 2023|2684024|72|2023-10-14 04:01:12|2023-10-14|04:01:12
254|Official Q&amp;A for Saturday, October 14, 2023|2684024|114|2023-10-14 04:01:11|2023-10-14|04:01:11
255|The Weekend Thread — 13th October 2023|2684024|114|2023-10-13 12:33:37|2023-10-13|12:33:37
257|Looking for a website that curates running videos (old and new). Do you know of one?|2684024|6|2023-10-13 18:53:23|2023-10-13|18:53:23
258|Weekend warrior with kids? Why I loved the Hansons Marathon Method (10/8 Race Report)|2684024|44|2023-10-12 15:51:09|2023-10-12|15:51:09
259|Looking for a running app that would import an ready existing running plan.|2684024|7|2023-10-13 18:20:56|2023-10-13|18:20:56
261|Official Q&amp;A for Friday, October 13, 2023|2684024|182|2023-10-13 04:01:10|2023-10-13|04:01:10
262|Races with the best swag?|2684024|59|2023-10-12 23:02:25|2023-10-12|23:02:25
263|Race report - my first ever marathon!|2684024|32|2023-10-12 17:11:19|2023-10-12|17:11:19
264|DC Half Marathon - if I can do it, so can you!|2684024|13|2023-10-12 14:13:46|2023-10-12|14:13:46
265|Achievements for Friday, October 13, 2023|2684024|17|2023-10-13 04:01:11|2023-10-13|04:01:11
266|Race report - Valley Harvest Marathon: no training plan and a post-tropical storm helped make a first marathon interesting|2684024|6|2023-10-12 15:08:54|2023-10-12|15:08:54
267|Eindhoven Half Marathon first-timer|2684024|13|2023-10-12 10:01:02|2023-10-12|10:01:02
269|Berlin Marathon 2024 - Swinley Travel / Running Crazy|2684024|1|2023-10-12 16:25:53|2023-10-12|16:25:53
270|For those who need faith in the marathon taper|2684024|35|2023-10-11 18:25:38|2023-10-11|18:25:38
271|High performing kids shoes|2684024|15|2023-10-12 04:58:41|2023-10-12|04:58:41
272|Finished My Marathon For My 26th Birthday!|2684024|28|2023-10-11 13:50:02|2023-10-11|13:50:02
273|Official Q&amp;A for Thursday, October 12, 2023|2684024|205|2023-10-12 04:01:10|2023-10-12|04:01:10
274|Best European half marathons?|2684024|9|2023-10-12 11:22:11|2023-10-12|11:22:11
275|Cape Cod Marathon|2684024|7|2023-10-11 19:12:22|2023-10-11|19:12:22
276|What are some good ways to avoid dangerous wildlife and does bear mace actually work?|2684024|28|2023-10-12 12:43:04|2023-10-12|12:43:04
277|Achievements for Thursday, October 12, 2023|2684024|24|2023-10-12 04:01:11|2023-10-12|04:01:11
278|Packable trucker hat like the OR performance trucker?|2684024|22|2023-10-11 16:45:27|2023-10-11|16:45:27
279|Question to running coaches in the UK 🏃‍♂️|2684024|5|2023-10-11 21:49:14|2023-10-11|21:49:14
