|title|subreddit_subscribers|num_comments|create_date|new_date|new_time
583|Achievements for Tuesday, September 12, 2023|2684024|33|2023-09-12 04:01:11|2023-09-12|04:01:11
584|Great North Run 2023 Race Report|2684024|35|2023-09-11 14:28:34|2023-09-11|14:28:34
586|Richmond (Run Fest) review|2684024|13|2023-09-11 11:54:20|2023-09-11|11:54:20
587|Richmond (Run Fest) Marathon - 10 September 2023|2684024|6|2023-09-11 11:52:10|2023-09-11|11:52:10
588|Fans of _Running with the Whole Body_?|2684024|5|2023-09-11 20:55:57|2023-09-11|20:55:57
590|Erie marathon: how everything went all wrong on my first marathon and it was still okay|2684024|61|2023-09-10 18:24:27|2023-09-10|18:24:27
591|Race report: REVEL Big Cottonwood, my first and last marathon|2684024|34|2023-09-10 16:01:29|2023-09-10|16:01:29
592|Achievements for Monday, September 11, 2023|2684024|73|2023-09-11 04:01:19|2023-09-11|04:01:19
593|Official Q&amp;A for Monday, September 11, 2023|2684024|238|2023-09-11 04:01:18|2023-09-11|04:01:18
595|Regina QCM Half Marathon Race Report|2684024|9|2023-09-10 18:31:31|2023-09-10|18:31:31
596|Running spikes for a cross-country runner?|2684024|12|2023-09-10 21:18:39|2023-09-10|21:18:39
597|Running routes in Allentown|2684024|1|2023-09-11 01:21:36|2023-09-11|01:21:36
598|Stockholm half marathon - beginner runs first half marathon, 1:56|2684024|29|2023-09-10 07:58:14|2023-09-10|07:58:14
599|Where to find .tcx, .fit, or .gpx files for races?|2684024|9|2023-09-10 19:06:08|2023-09-10|19:06:08
600|What does your ideal race event include?|2684024|239|2023-09-09 21:44:01|2023-09-09|21:44:01
601|Richmond Runfest Marathon / Half (London)|2684024|20|2023-09-10 14:39:35|2023-09-10|14:39:35
602|Give me your best running related tips that does not include actually running!|2684024|376|2023-09-09 19:06:22|2023-09-09|19:06:22
603|Balancing running/sports/working out|2684024|51|2023-09-09 21:29:52|2023-09-09|21:29:52
604|Running recs for Roswell, GA?|2684024|19|2023-09-10 15:46:51|2023-09-10|15:46:51
605|Achievements for Sunday, September 10, 2023|2684024|71|2023-09-10 04:01:15|2023-09-10|04:01:15
606|Stockholm half marathon: a 15 minute PB.|2684024|7|2023-09-09 20:27:20|2023-09-09|20:27:20
607|Official Q&amp;A for Sunday, September 10, 2023|2684024|134|2023-09-10 04:01:13|2023-09-10|04:01:13
608|Zone 2 problem - How should you run comfortably?|2684024|65|2023-09-09 19:52:50|2023-09-09|19:52:50
609|Race Report: Midnight Run Helsinki (first ever race!)|2684024|4|2023-09-09 22:04:05|2023-09-09|22:04:05
611|Running group advice|2684024|24|2023-09-09 15:54:36|2023-09-09|15:54:36
612|Good running routes near Zeeburg in Amsterdam?|2684024|8|2023-09-09 15:05:41|2023-09-09|15:05:41
613|Yet another treadmill post - need help finding my glass slipper|2684024|41|2023-09-09 21:40:37|2023-09-09|21:40:37
614|Question for female runners - diva cup?|2684024|228|2023-09-08 17:55:44|2023-09-08|17:55:44
615|Official Q&amp;A for Saturday, September 09, 2023|2684024|147|2023-09-09 04:01:12|2023-09-09|04:01:12
616|Achievements for Saturday, September 09, 2023|2684024|95|2023-09-09 04:01:14|2023-09-09|04:01:14
617|Running virtual group app?|2684024|1|2023-09-09 13:09:24|2023-09-09|13:09:24
619|Underwear help for lady runner|2684024|137|2023-09-08 14:20:25|2023-09-08|14:20:25
620|How much z2-z4 cycling would you have to do to replace road running KMs?|2684024|6|2023-09-09 09:29:23|2023-09-09|09:29:23
621|JPMCC 3.5 Miles Result|2684024|1|2023-09-08 14:10:43|2023-09-08|14:10:43
622|"5"" Running Shorts with Back Center Pocket, Mens"|2684024|46|2023-09-08 19:29:00|2023-09-08|19:29:00
623|Stinky running clothes|2684024|205|2023-09-08 03:46:34|2023-09-08|03:46:34
625|Is it possible to decrease the chafing on some tshirts/singlets?|2684024|25|2023-09-08 09:52:52|2023-09-08|09:52:52
626|The Weekend Thread — 8th September 2023|2684024|112|2023-09-08 12:12:13|2023-09-08|12:12:13
627|How do I stop feeling sad about a bad race?|2684024|68|2023-09-08 00:46:58|2023-09-08|00:46:58
628|Siblings Cancer Battle: Successfully Fundraising Through Marathoning|2684024|1|2023-09-08 20:44:11|2023-09-08|20:44:11
630|Official Q&amp;A for Friday, September 08, 2023|2684024|197|2023-09-08 04:01:11|2023-09-08|04:01:11
631|How to become a pacer|2684024|9|2023-09-07 21:55:36|2023-09-07|21:55:36
632|Achievements for Friday, September 08, 2023|2684024|28|2023-09-08 04:01:12|2023-09-08|04:01:12
633|Too hot to trot? It’s the Weekly Complaints and Confessions Thread|2684024|237|2023-09-07 12:23:53|2023-09-07|12:23:53
634|Marathon ideas for my 50th birthday|2684024|56|2023-09-07 13:02:15|2023-09-07|13:02:15
635|Marathon Shoe Recs for Heavier Dudes|2684024|68|2023-09-07 10:51:37|2023-09-07|10:51:37
636|11,000 runners DQ'd from Mexico City Marathon...what is going on?|2684024|209|2023-09-06 17:28:35|2023-09-06|17:28:35
637|omm kamleika race jacket|2684024|4|2023-09-07 22:18:10|2023-09-07|22:18:10
638|World Marathon Major Competitors?|2684024|18|2023-09-07 15:25:02|2023-09-07|15:25:02
639|Any shoe suggestions that go way below ankle? Low profile?|2684024|9|2023-09-07 18:15:49|2023-09-07|18:15:49
640|Super sweaty people - hello! looking for advice - eye sweat!|2684024|57|2023-09-07 01:53:23|2023-09-07|01:53:23
641|Best way to support NYC marathon runners?|2684024|65|2023-09-06 17:19:30|2023-09-06|17:19:30
642|New Haven Half Marathon (One Very Long Venting Session)|2684024|27|2023-09-06 23:46:11|2023-09-06|23:46:11
643|Marathon race day temperature is going to be far hotter than expected. How to approach it?|2684024|186|2023-09-06 12:45:31|2023-09-06|12:45:31
644|Any recommendations for durable underwear brands?|2684024|59|2023-09-07 02:04:08|2023-09-07|02:04:08
645|Books about running nutrition?|2684024|38|2023-09-06 18:22:53|2023-09-06|18:22:53
646|Achievements for Thursday, September 07, 2023|2684024|33|2023-09-07 04:01:13|2023-09-07|04:01:13
647|Official Q&amp;A for Thursday, September 07, 2023|2684024|217|2023-09-07 04:01:12|2023-09-07|04:01:12
648|I am struggling to extend my long runs|2684024|63|2023-09-06 15:39:49|2023-09-06|15:39:49
649|HOKA Helsingborg Half Marathon|2684024|1|2023-09-06 17:06:58|2023-09-06|17:06:58
650|What metrics are actually worthwhile?|2684024|96|2023-09-06 10:57:51|2023-09-06|10:57:51
651|Nao+ vs Nao RL?|2684024|6|2023-09-07 08:37:00|2023-09-07|08:37:00
652|Could anyone recommend a reasonably priced treadmill?|2684024|43|2023-09-06 15:53:19|2023-09-06|15:53:19
653|Modifying a 50k plan for a 40 mile run|2684024|4|2023-09-06 20:06:59|2023-09-06|20:06:59
654|Running Vest : Water flask taste|2684024|14|2023-09-06 11:40:13|2023-09-06|11:40:13
655|Paris Running|2684024|35|2023-09-06 01:25:59|2023-09-06|01:25:59
656|Official Q&amp;A for Wednesday, September 06, 2023|2684024|255|2023-09-06 04:01:16|2023-09-06|04:01:16
657|Achievements for Wednesday, September 06, 2023|2684024|26|2023-09-06 04:01:17|2023-09-06|04:01:17
660|Denver Broncos 7K|2684024|12|2023-09-05 14:00:50|2023-09-05|14:00:50
662|Times when you’ve been humbled|2684024|167|2023-09-05 01:08:57|2023-09-05|01:08:57
663|Helsingborg marathon race report - best time, worst race.|2684024|7|2023-09-05 13:18:11|2023-09-05|13:18:11
664|5km run with cool medal|2684024|21|2023-09-05 16:29:14|2023-09-05|16:29:14
665|Are there good running brands with no branding at all?|2684024|189|2023-09-04 15:56:29|2023-09-04|15:56:29
666|Opinion on new On Running Vest|2684024|3|2023-09-05 14:21:50|2023-09-05|14:21:50
667|Achievements for Tuesday, September 05, 2023|2684024|30|2023-09-05 04:01:17|2023-09-05|04:01:17
670|Anyone tried District Vision Mindfulness Course?|2684024|1|2023-09-05 15:26:27|2023-09-05|15:26:27
671|Race Report: 21k Guatemala City's Half Marathon|2684024|12|2023-09-04 18:22:26|2023-09-04|18:22:26
672|Official Q&amp;A for Tuesday, September 05, 2023|2684024|133|2023-09-05 04:01:16|2023-09-05|04:01:16
673|Race Report: First Marathon, Göteborgsvarvet Marathon|2684024|9|2023-09-04 08:16:21|2023-09-04|08:16:21
674|My first HM race - Switzerland Marathon Light|2684024|3|2023-09-04 14:47:42|2023-09-04|14:47:42
675|The Vitality Big Half, London, United Kingdom|2684024|10|2023-09-04 19:16:53|2023-09-04|19:16:53
676|Best running app for Galaxy Watch 5?|2684024|3|2023-09-04 22:21:24|2023-09-04|22:21:24
678|How to you prepare for the last 10k of a marathon?|2684024|231|2023-09-03 13:52:09|2023-09-03|13:52:09
679|Training Suggestions for 70+ Runner|2684024|71|2023-09-03 18:07:45|2023-09-03|18:07:45
680|Race Report: Cumbernauld 10k|2684024|6|2023-09-03 21:02:53|2023-09-03|21:02:53
681|Achievements for Monday, September 04, 2023|2684024|50|2023-09-04 04:01:17|2023-09-04|04:01:17
682|Official Q&amp;A for Monday, September 04, 2023|2684024|211|2023-09-04 04:01:16|2023-09-04|04:01:16
684|Running Gear Labor Day Sales|2684024|64|2023-09-02 22:12:26|2023-09-02|22:12:26
685|Twin Cities (USA) marathon advice|2684024|37|2023-09-02 21:52:02|2023-09-02|21:52:02
686|Helsingborg Half Marathon race report - baby’s first HM!|2684024|19|2023-09-02 16:04:25|2023-09-02|16:04:25
687|Achievements for Sunday, September 03, 2023|2684024|61|2023-09-03 04:01:16|2023-09-03|04:01:16
688|Official Q&amp;A for Sunday, September 03, 2023|2684024|182|2023-09-03 04:01:14|2023-09-03|04:01:14
690|Good Ultra Road Races?|2684024|42|2023-09-02 12:23:51|2023-09-02|12:23:51
691|Watches for tattooed arms|2684024|20|2023-09-02 23:59:59|2023-09-02|23:59:59
692|Race / event finder with map|2684024|1|2023-09-02 17:39:13|2023-09-02|17:39:13
693|Running sunglasses for big noses?|2684024|13|2023-09-02 17:12:03|2023-09-02|17:12:03
694|Runners who leave water to pick up and drink along your route...|2684024|212|2023-09-02 01:44:32|2023-09-02|01:44:32
695|How to be a Good Half Marathon Pacer?|2684024|139|2023-09-01 18:34:08|2023-09-01|18:34:08
696|Temu 2 in 1 review|2684024|8|2023-09-02 21:41:12|2023-09-02|21:41:12
697|Struggling to see improvements in my runs|2684024|0|2023-09-02 19:05:31|2023-09-02|19:05:31
698|Strava vs. Garmin Connect|2684024|86|2023-09-02 00:56:39|2023-09-02|00:56:39
699|Setting Goals Based on Long Runs|2684024|21|2023-09-02 17:35:41|2023-09-02|17:35:41
700|Stash/backpack ideas for taking action cams on longer runs|2684024|2|2023-09-02 15:52:02|2023-09-02|15:52:02
701|Discomfort vs Pain|2684024|69|2023-09-01 14:10:08|2023-09-01|14:10:08
702|Official Q&amp;A for Saturday, September 02, 2023|2684024|117|2023-09-02 04:01:14|2023-09-02|04:01:14
703|Achievements for Saturday, September 02, 2023|2684024|54|2023-09-02 04:01:16|2023-09-02|04:01:16
705|Eat spicy food and run faster? :)|2684024|45|2023-09-01 11:45:05|2023-09-01|11:45:05
707|Sea level to high altitude. How should I prepare/train?|2684024|21|2023-09-01 19:54:31|2023-09-01|19:54:31
708|Tips on Losing Toenails?|2684024|25|2023-09-01 19:06:23|2023-09-01|19:06:23
709|Best half marathons in San Diego, CA?|2684024|9|2023-09-01 19:40:52|2023-09-01|19:40:52
710|The UTMB is this week (Weekend)|2684024|28|2023-09-01 09:49:06|2023-09-01|09:49:06
711|Looking for running shoes for wide feet (women)|2684024|55|2023-09-01 19:38:45|2023-09-01|19:38:45
712|The Weekend Thread — 1st September 2023|2684024|113|2023-09-01 12:07:01|2023-09-01|12:07:01
713|Running 400m at Kipchoge's pace|2684024|115|2023-08-31 12:38:21|2023-08-31|12:38:21
714|Making strength and mobility as fun as running?|2684024|29|2023-08-31 21:14:25|2023-08-31|21:14:25
715|Sioux Falls Marathon Race Report- An Almost BQ on a Questionable Course|2684024|2|2023-08-31 20:23:37|2023-08-31|20:23:37
716|Official Q&amp;A for Friday, September 01, 2023|2684024|110|2023-09-01 04:01:17|2023-09-01|04:01:17
717|August Monthly Updates &amp; Check In Thread|2684024|28|2023-09-01 05:11:22|2023-09-01|05:11:22
719|Mount Maunganui (NZ) Half Marathon|2684024|7|2023-08-31 11:26:30|2023-08-31|11:26:30
720|Mentally (and physically) coping with injury during marathon build - when to give up on a goal race?|2684024|43|2023-08-31 15:43:05|2023-08-31|15:43:05
721|Achievements for Friday, September 01, 2023|2684024|6|2023-09-01 04:01:19|2023-09-01|04:01:19
722|Osprey backpacks for running commutes|2684024|18|2023-08-31 12:57:55|2023-08-31|12:57:55
723|Any tips for making my daughter's first 5k a fun experience?|2684024|106|2023-08-30 19:47:35|2023-08-30|19:47:35
725|Santa Rosa Marathon- Respect the Distance|2684024|11|2023-08-30 19:54:09|2023-08-30|19:54:09
726|Official Q&amp;A for Thursday, August 31, 2023|2684024|197|2023-08-31 04:01:11|2023-08-31|04:01:11
727|Stinky Shoes|2684024|58|2023-08-30 21:17:43|2023-08-30|21:17:43
728|Achievements for Thursday, August 31, 2023|2684024|28|2023-08-31 04:01:12|2023-08-31|04:01:12
729|Remote fitness tracker app for following a marathon runner|2684024|44|2023-08-30 20:34:33|2023-08-30|20:34:33
730|Versatile but good looking sneaker rec?|2684024|50|2023-08-31 01:32:19|2023-08-31|01:32:19
731|Looking for a portable tool for resisted/over-speed sprint work — any thoughts?|2684024|2|2023-08-30 20:12:15|2023-08-30|20:12:15
732|First Time NYC Marathon Runner Here! What Happens Between The Staten Island Ferry and the Starting Line??|2684024|13|2023-08-30 16:15:36|2023-08-30|16:15:36
733|Training for 10k with a jogging stroller, possible? Any thoughts?|2684024|96|2023-08-29 21:46:59|2023-08-29|21:46:59
734|Alleycat Running Race|2684024|8|2023-08-30 15:49:52|2023-08-30|15:49:52
735|Tips for Equinox 24|2684024|1|2023-08-30 11:29:16|2023-08-30|11:29:16
736|Running shorts with pockets that fit larger smartphones in 2023?|2684024|180|2023-08-29 21:13:23|2023-08-29|21:13:23
737|Best Race Bibs|2684024|1|2023-08-30 19:11:23|2023-08-30|19:11:23
738|Aqua jogging recs|2684024|10|2023-08-30 19:04:23|2023-08-30|19:04:23
740|January Marathons?|2684024|11|2023-08-30 12:39:10|2023-08-30|12:39:10
741|Good brands for natural fabric men's running / workout clothes without plastic-based synthetics? e.g. Bamboo, Tencel, Merino etc|2684024|19|2023-08-30 23:36:31|2023-08-30|23:36:31
742|Official Q&amp;A for Wednesday, August 30, 2023|2684024|201|2023-08-30 04:01:12|2023-08-30|04:01:12
744|Billings Montana running|2684024|4|2023-08-30 04:35:18|2023-08-30|04:35:18
745|Achievements for Wednesday, August 30, 2023|2684024|42|2023-08-30 04:01:13|2023-08-30|04:01:13
746|Running Shoes for Rain and Snow|2684024|18|2023-08-29 22:06:07|2023-08-29|22:06:07
747|My running data for one year, visualized|2684024|33|2023-08-28 21:22:38|2023-08-28|21:22:38
748|Race Report: Santa Rosa Half Marathon - how the hell did I finish within 2 hours?|2684024|19|2023-08-29 01:03:08|2023-08-29|01:03:08
749|Carb loading on training runs that are half-mara distance?|2684024|33|2023-08-29 05:25:51|2023-08-29|05:25:51
750|Anyone use Mi Band Pro 7/8?|2684024|7|2023-08-29 17:55:55|2023-08-29|17:55:55
753|Gymshark shorts dupes?|2684024|7|2023-08-29 11:43:30|2023-08-29|11:43:30
754|Official Q&amp;A for Tuesday, August 29, 2023|2684024|150|2023-08-29 04:01:15|2023-08-29|04:01:15
755|Does partaking in official runs motivate or demotivate you?|2684024|189|2023-08-28 13:08:32|2023-08-28|13:08:32
756|Achievements for Tuesday, August 29, 2023|2684024|26|2023-08-29 04:01:17|2023-08-29|04:01:17
758|Women’s shorts &amp; phone holder for half marathon?|2684024|95|2023-08-28 14:56:34|2023-08-28|14:56:34
760|Nylon Plate as Prep for Carbon Plate?|2684024|28|2023-08-28 12:14:01|2023-08-28|12:14:01
761|Race Report: ABSA Run Your City Tshwane 10km|2684024|6|2023-08-28 09:08:30|2023-08-28|09:08:30
762|Race Report - Santa Cruz Trail Race (Half Marathon)|2684024|2|2023-08-28 07:02:26|2023-08-28|07:02:26
763|Running Hair|2684024|90|2023-08-27 20:22:52|2023-08-27|20:22:52
764|Official Q&amp;A for Monday, August 28, 2023|2684024|151|2023-08-28 04:01:20|2023-08-28|04:01:20
766|Chicago lakefront path: water and restroom options?|2684024|17|2023-08-27 21:45:40|2023-08-27|21:45:40
767|Achievements for Monday, August 28, 2023|2684024|27|2023-08-28 04:01:22|2023-08-28|04:01:22
768|Running in Niagara Falls|2684024|12|2023-08-27 21:10:36|2023-08-27|21:10:36
769|Trusting the Huawei GT Runner AI running plan|2684024|7|2023-08-27 16:08:55|2023-08-27|16:08:55
770|Possible to have an overlay of my previous routes AND my live location?|2684024|5|2023-08-28 00:05:31|2023-08-28|00:05:31
771|My First Marathon - Sandy Point HM|2684024|2|2023-08-27 09:57:24|2023-08-27|09:57:24
772|Sub 2:00 Half (Kinda)|2684024|43|2023-08-26 20:10:33|2023-08-26|20:10:33
773|Marathon course difficulty|2684024|7|2023-08-27 07:10:40|2023-08-27|07:10:40
774|Thoughts on skincare for runnning?|2684024|82|2023-08-26 21:51:48|2023-08-26|21:51:48
775|Experience running Happy Holidays Half Marathon in Long Beach CA hosted by ABWR?|2684024|3|2023-08-27 18:06:14|2023-08-27|18:06:14
776|I used the Strava API and Python to visualize my running data by shoe|2684024|11|2023-08-26 14:58:23|2023-08-26|14:58:23
777|Official Q&amp;A for Sunday, August 27, 2023|2684024|138|2023-08-27 04:01:13|2023-08-27|04:01:13
778|Compression clothing, for a lot of loose skin and fat. Advice needed|2684024|13|2023-08-26 22:01:03|2023-08-26|22:01:03
779|World Champs Marathon, why no Kipchoge &amp; Kiptum?|2684024|35|2023-08-26 19:43:33|2023-08-26|19:43:33
780|I never heard of this Runner, you most likely haven't either. But his story is inspirational|2684024|3|2023-08-27 00:18:51|2023-08-27|00:18:51
781|Achievements for Sunday, August 27, 2023|2684024|74|2023-08-27 04:01:14|2023-08-27|04:01:14
783|Looking for HR zone apps that display HR while running|2684024|20|2023-08-27 08:48:12|2023-08-27|08:48:12
784|Prime Energy Drinks for running?|2684024|23|2023-08-27 13:58:05|2023-08-27|13:58:05
785|Tignes Trail 2023|2684024|1|2023-08-26 19:10:34|2023-08-26|19:10:34
786|Team Captains, what have you done to leave a lasting impact on your team?|2684024|7|2023-08-27 01:33:05|2023-08-27|01:33:05
787|What are your favourite European marathons?|2684024|116|2023-08-25 15:34:28|2023-08-25|15:34:28
788|Achievements for Saturday, August 26, 2023|2684024|95|2023-08-26 04:01:15|2023-08-26|04:01:15
789|Official Q&amp;A for Saturday, August 26, 2023|2684024|153|2023-08-26 04:01:14|2023-08-26|04:01:14
791|Road/track mile races in Colorado|2684024|3|2023-08-25 19:09:08|2023-08-25|19:09:08
792|USA's Noah Lyles v Usain Bolt? I think he has it|2684024|20|2023-08-25 11:31:04|2023-08-25|11:31:04
793|Abbott road to the majors extra draws|2684024|4|2023-08-25 20:28:21|2023-08-25|20:28:21
794|Non-runner ran the Brooklyn Half (a while ago)|2684024|53|2023-08-24 23:13:29|2023-08-24|23:13:29
796|The Weekend Thread — 25th August 2023|2684024|63|2023-08-25 12:08:43|2023-08-25|12:08:43
797|Running a tough 30k trail race and a week after another real tough 56k. So.... Got any recovery tips?|2684024|5|2023-08-25 07:33:08|2023-08-25|07:33:08
798|Official Q&amp;A for Friday, August 25, 2023|2684024|145|2023-08-25 04:01:11|2023-08-25|04:01:11
799|How to do/incorporate tempo runs? Newbie in running|2684024|24|2023-08-24 14:45:46|2023-08-24|14:45:46
801|Achievements for Friday, August 25, 2023|2684024|24|2023-08-25 04:01:13|2023-08-25|04:01:13
802|How should running form change when using a jogging stroller? Looking for cues and advice|2684024|43|2023-08-24 10:39:00|2023-08-24|10:39:00
804|What are your favorite US marathons?|2684024|242|2023-08-23 21:18:41|2023-08-23|21:18:41
805|Achievements for Thursday, August 24, 2023|2684024|53|2023-08-24 04:01:12|2023-08-24|04:01:12
806|Official Q&amp;A for Thursday, August 24, 2023|2684024|159|2023-08-24 04:01:10|2023-08-24|04:01:10
807|Best races (trail or road) in a state that borders KY?|2684024|11|2023-08-23 19:24:59|2023-08-23|19:24:59
808|Suggestions for a convenient T&amp;F result sorter to stay up to date on T&amp;F|2684024|9|2023-08-23 12:36:46|2023-08-23|12:36:46
809|Best way to track results for friends race|2684024|3|2023-08-23 20:19:25|2023-08-23|20:19:25
811|8000 runs: a love letter to running|2684024|37|2023-08-22 11:38:57|2023-08-22|11:38:57
812|Cooling vest with hydration?|2684024|13|2023-08-23 02:23:46|2023-08-23|02:23:46
813|Official Q&amp;A for Wednesday, August 23, 2023|2684024|198|2023-08-23 04:01:11|2023-08-23|04:01:11
815|If you invite a friend to register for a race with you, do you run the whole course alongside them on race day?|2684024|87|2023-08-22 11:02:48|2023-08-22|11:02:48
816|Achievements for Wednesday, August 23, 2023|2684024|17|2023-08-23 04:01:12|2023-08-23|04:01:12
817|Running Vest - Bladder vs Bottles|2684024|106|2023-08-22 12:27:58|2023-08-22|12:27:58
818|"Do you have any good suggestions for ""group fitness"" running class apps?"|2684024|20|2023-08-22 19:19:11|2023-08-22|19:19:11
819|London City Long Runs|2684024|10|2023-08-22 18:13:48|2023-08-22|18:13:48
820|Short, Old and ran my first marathon|2684024|87|2023-08-21 16:25:49|2023-08-21|16:25:49
821|Sub 20min 5k women - please share your story!|2684024|116|2023-08-21 20:23:15|2023-08-21|20:23:15
822|Lactate test worth it?|2684024|31|2023-08-22 11:42:51|2023-08-22|11:42:51
824|Has anybody used a hrm and watch religiously then stopped? Why?|2684024|87|2023-08-22 07:04:16|2023-08-22|07:04:16
825|Quitting a training plan and reassessing goals|2684024|16|2023-08-22 04:54:36|2023-08-22|04:54:36
826|Experiences with a long-lasting injury?|2684024|31|2023-08-22 03:06:04|2023-08-22|03:06:04
827|Edmonton Army 10K - Second 10K Race!|2684024|9|2023-08-21 21:58:55|2023-08-21|21:58:55
828|Official Q&amp;A for Tuesday, August 22, 2023|2684024|178|2023-08-22 04:01:12|2023-08-22|04:01:12
829|Achievements for Tuesday, August 22, 2023|2684024|31|2023-08-22 04:01:13|2023-08-22|04:01:13
832|Favorite trails near Alexandria VA?|2684024|6|2023-08-22 01:02:45|2023-08-22|01:02:45
833|Post-Run Recovery: Anyone else tried Ice Baths to soothe those aching muscles?|2684024|41|2023-08-21 16:26:36|2023-08-21|16:26:36
834|Falmouth Road Race|2684024|10|2023-08-21 16:37:31|2023-08-21|16:37:31
835|What to do pre-marathon plan|2684024|12|2023-08-21 16:23:01|2023-08-21|16:23:01
836|First (proper) race experience|2684024|8|2023-08-21 03:16:17|2023-08-21|03:16:17
837|Where to run?|2684024|30|2023-08-21 13:51:37|2023-08-21|13:51:37
838|Frank Duffy 10 Mile|2684024|14|2023-08-21 08:44:14|2023-08-21|08:44:14
840|Race Report - Headlands 50k|2684024|13|2023-08-20 21:55:32|2023-08-20|21:55:32
841|Running in Scottsdale AZ|2684024|8|2023-08-21 15:24:07|2023-08-21|15:24:07
843|Achievements for Monday, August 21, 2023|2684024|39|2023-08-21 04:01:12|2023-08-21|04:01:12
844|Official Q&amp;A for Monday, August 21, 2023|2684024|274|2023-08-21 04:01:11|2023-08-21|04:01:11
845|400 Mile Review: ASICS Gel-Nimbus 22 Tokyo|2684024|53|2023-08-20 15:46:34|2023-08-20|15:46:34
846|Running in DC - is it safe?|2684024|59|2023-08-21 00:13:41|2023-08-21|00:13:41
847|Homestead/Miami area|2684024|7|2023-08-20 23:19:54|2023-08-20|23:19:54
848|Achievements for Sunday, August 20, 2023|2684024|114|2023-08-20 04:01:11|2023-08-20|04:01:11
849|Training for a race involves a lot of trade offs. How do you find balance between your life and a grueling training routine?|2684024|106|2023-08-19 18:36:03|2023-08-19|18:36:03
850|Best ~$200 (or less) you can spend to compliment your running regime? (NOT shoes/clothes)|2684024|179|2023-08-19 14:09:24|2023-08-19|14:09:24
851|Official Q&amp;A for Sunday, August 20, 2023|2684024|178|2023-08-20 04:01:11|2023-08-20|04:01:11
853|High Crown Running Hat?|2684024|56|2023-08-19 09:32:56|2023-08-19|09:32:56
854|Achievements for Saturday, August 19, 2023|2684024|72|2023-08-19 04:01:13|2023-08-19|04:01:13
855|Apps that provide voice directions based on a marathon course (it's at night...)?|2684024|9|2023-08-19 21:15:32|2023-08-19|21:15:32
856|Greenlayer shirts|2684024|2|2023-08-19 20:30:43|2023-08-19|20:30:43
857|Official Q&amp;A for Saturday, August 19, 2023|2684024|148|2023-08-19 04:01:13|2023-08-19|04:01:13
858|A first time marathoner's review of the Run with Hal app|2684024|43|2023-08-18 14:29:53|2023-08-18|14:29:53
860|High arches|2684024|20|2023-08-19 02:25:28|2023-08-19|02:25:28
861|Ny shoes store?!?!|2684024|10|2023-08-19 19:18:24|2023-08-19|19:18:24
862|Replacement shorts for NorthFace Better Than Naked|2684024|13|2023-08-18 17:17:52|2023-08-18|17:17:52
863|Heavy legs on runs. Why does this happen?|2684024|172|2023-08-17 23:19:04|2023-08-17|23:19:04
864|What's a functional glute exercise that excludes the quads?|2684024|54|2023-08-18 02:21:48|2023-08-18|02:21:48
865|The Weekend Thread — 18th August 2023|2684024|105|2023-08-18 12:17:09|2023-08-18|12:17:09
866|Understanding rest periods during workouts|2684024|22|2023-08-18 01:16:38|2023-08-18|01:16:38
867|Achievements for Friday, August 18, 2023|2684024|28|2023-08-18 04:01:10|2023-08-18|04:01:10
868|So much saliva|2684024|44|2023-08-17 20:40:09|2023-08-17|20:40:09
869|Official Q&amp;A for Friday, August 18, 2023|2684024|174|2023-08-18 04:01:09|2023-08-18|04:01:09
872|Revel Big Bear Runnes &amp; Downhill Racing|2684024|22|2023-08-17 22:30:05|2023-08-17|22:30:05
873|Can’t sleep after running|2684024|108|2023-08-17 04:54:31|2023-08-17|04:54:31
874|Unique races/events|2684024|32|2023-08-17 10:50:19|2023-08-17|10:50:19
875|Looking for a flat November half, for PR attempt. Anyone run Texas Quad?|2684024|26|2023-08-17 16:16:44|2023-08-17|16:16:44
876|Water for naked band recs?|2684024|39|2023-08-17 05:30:39|2023-08-17|05:30:39
877|Goodr Sunglasses Are Bad - Looking for Alternatives|2684024|184|2023-08-17 01:40:34|2023-08-17|01:40:34
878|Achievements for Thursday, August 17, 2023|2684024|28|2023-08-17 04:01:12|2023-08-17|04:01:12
879|NYC Run CLub Suggestions|2684024|5|2023-08-17 14:36:01|2023-08-17|14:36:01
880|Looking for running route reccomendations in Bali.|2684024|7|2023-08-17 13:51:18|2023-08-17|13:51:18
881|Official Q&amp;A for Thursday, August 17, 2023|2684024|183|2023-08-17 04:01:11|2023-08-17|04:01:11
882|Silly stuff we buy over and over again but never use|2684024|62|2023-08-16 18:24:27|2023-08-16|18:24:27
883|Salomon XA 15 backpack|2684024|1|2023-08-17 08:44:49|2023-08-17|08:44:49
