|title|subreddit_subscribers|num_comments|create_date|new_date|new_time
167|Being tough is overrated. Proven by our friends Igor and Bob. Let’s take the toughest guy in the world right now; Igor, a Siberian woodsman who lives in a cabin in a forest. He has a forest of thick black hairs on his back. His muscles look like coiled snakes from all the chopping.|1742|0|2021-02-24 16:32:56|2021-02-24|16:32:56
168|Are you over training as a result? How to train around COVID-19 and how to keep ticking along.|1742|0|2021-02-21 16:31:41|2021-02-21|16:31:41
169|Over the last few months we have all struggled with a loss of motivation. So when I saw the #VRTTS virtual race to the stones 100k I knew this was a challenge I wanted to be part of.|1742|0|2021-02-17 16:30:53|2021-02-17|16:30:53
170|run meme|1742|0|2021-02-15 03:03:57|2021-02-15|03:03:57
171|What are high intensity workouts actually doing for our health and is there value in long slow runs? If I asked you to name the most common cause of disease related deaths in The United States of America, or here in the United Kingdom, what would spring to mind?|1742|0|2021-02-14 08:31:36|2021-02-14|08:31:36
172|I am running and trying to exceed my speed limits I have discovered some parts of me that resist. How can I run faster without losing my spleen?|1742|0|2021-02-13 10:36:45|2021-02-13|10:36:45
173|Paddy Buckley Round The Paddy Buckley Round is a 62 mile tour around Snowdonia, which takes in 47 summits. It can be done in any direction, can start from anywhere on the route, with or without assistance, and there is an arbitrary goal of completing it within 24hrs.|1742|0|2021-02-12 10:31:04|2021-02-12|10:31:04
174|Instructions on how to calibrate the speed of the Elite E8i NoblePro treadmill for a more accurate run. Link: https://www.noble-pro.com/guides/how-to-calibrate-my-elite-e8i/ Note: This feature is only available for software versions 1.3.5 or newer. What will I need? Noble|1742|0|2021-02-09 08:32:44|2021-02-09|08:32:44
175|I don’t know if society has changed or if it has always been like this. We want things easy. We want a quick fix. The route of least resistance. There’s no true satisfaction in being handed something on a plate. The real paradise is found in the hard graft. The journey towards success.|1742|0|2021-02-06 09:31:18|2021-02-06|09:31:18
176|Being visually impaired means I can't run without a guide so during lockdown my treadmill is a lifesaver.|1742|0|2021-02-05 09:03:08|2021-02-05|09:03:08
177|HELP ANNA|1742|0|2021-02-03 16:50:40|2021-02-03|16:50:40
178|Panel discussion on mental health as a BIPOC runner in 2020 hosted by Carolyn Su and Marcus Brown.|1742|0|2021-02-02 08:02:49|2021-02-02|08:02:49
179|Hit my goal of 100km for the month of January! First resolution of 2021 complete!|1742|1|2021-01-30 02:26:48|2021-01-30|02:26:48
180|So I was approached while doing my speed reps on the track in Canterbury back in the summer by a guy called Antonis Kesisoglou who asked if I could be on his research project for his publication. I have been on a few tests before mentioned in previous blogs that have helped me to improve.|1742|0|2021-01-28 09:31:33|2021-01-28|09:31:33
181|Usually I enjoy writing my race recap, to review the year gone by. After an absolutely amazing 2019 I had planned an even better 2020.|1742|0|2021-01-25 08:49:29|2021-01-25|08:49:29
182|When it comes to strength training, most runners are interested in exactly how little gym time they can get away with in order to see maximum results.|1742|0|2021-01-18 10:59:54|2021-01-18|10:59:54
183|I just ran 10k in celebration of my 33rd birthday!|1742|0|2021-01-16 22:57:55|2021-01-16|22:57:55
184|After a turbulent year with injuries my training started to progress through the Summer and I decided to try and break 32 minutes for 10K. Here is a short vlog of my race day. Feel free to leave any comments or feedback.|1742|0|2021-01-16 09:02:48|2021-01-16|09:02:48
185|Eliud Kipchoge - Motivational Tribute (HE MADE HISTORY)|1742|0|2021-01-16 10:17:12|2021-01-16|10:17:12
186|WTch this run video|1742|0|2021-01-15 04:16:33|2021-01-15|04:16:33
187|RACE DAY!!! DeMoor Global Running Virtual Races 2020: My Half Marathon report. Please SUBSCRIBE for more crazy challenges! Lockdown is a time for some fun running! I thought I'd give the treadmill Half Marathon World Record a literal run for its money. The current record stands at 1:03:38...|1742|0|2021-01-13 08:31:37|2021-01-13|08:31:37
188|Michael tears over the ground…A whirlwind of power and speed. By the time he reaches the first wall, he is so far in front, he has already won, it takes us a second to realise this, then we start screaming.|1742|0|2021-01-10 09:05:30|2021-01-10|09:05:30
189|When I first started swimming and running back in 2012, I didn’t know about Aquathlon’s but I did of course know what Triathlon’s where. I wasn’t very good on the bike and kept getting injured because it wasn’t set up right.|1742|0|2021-01-08 08:33:24|2021-01-08|08:33:24
190|Usually I am pretty certain about my goals for the year. I am a strong believer that target setting is important to help maintain motivation, and provide structure.|1742|0|2021-01-07 16:30:23|2021-01-07|16:30:23
191|Free women joggers|1742|0|2021-01-07 06:39:52|2021-01-07|06:39:52
192|Been a fan of this sub for a while, and made a video on my experiences with running|1742|0|2021-01-01 14:53:27|2021-01-01|14:53:27
193|As a new runner, I am curious how the pandemic has changed (if at all) your running habits?|1742|0|2020-12-29 21:30:33|2020-12-29|21:30:33
194|The Beginning The 10km is great distance to train for, as a step up from a parkrun and not as tough as a half or full marathon! As a runner and then becoming a coach, I've learnt from previous mistakes such as:|1742|0|2020-12-25 16:35:48|2020-12-25|16:35:48
195|I have been running since 2015. One of the main reasons I started running is because I was struggling with anxiety and had been recommended running as a way to help. Running isn’t a cure but personally it has really helped me. I have struggled with anxiety for many years.|1742|2|2020-12-22 16:31:29|2020-12-22|16:31:29
196|You've done the hard miles and you're into the tapering period of your training. All you can do now is rest and finalise your preparations so the big day can go off without a hitch.|1742|0|2020-12-20 16:31:28|2020-12-20|16:31:28
197|The 2020 London Marathon is unlike any other. It would have been my 6th time standing on the start line, but instead of the start line being at Greenwich Park, this year it is right outside my own front door. There won’t be any crowds or a sky filled with multicoloured inflatables; there will be no|1742|0|2020-12-19 16:31:08|2020-12-19|16:31:08
198|Tavistock Athletic Club’s long-standing 7-mile road race is on its third course since it was started in the late 1980s. It is now held on Dartmoor on an undulating but fantastically scenic course.|1742|0|2020-12-15 16:33:44|2020-12-15|16:33:44
199|Two years ago I did this race…..my blog is a great memory of a fantastic event in a beautiful place. Qeshm Island is located a few miles off the southern coast of Iran in the Persian Gulf opposite the port cities of Bhandar Abbas and Khamir.|1742|0|2020-12-07 16:34:02|2020-12-07|16:34:02
200|I'm going to start my first blog off by saying thank you to NoblePro for giving me the chance to become one of their ambassadors - I'm still pinching myself. I thought I would introduce myself and give you some background information about me.|1742|0|2020-12-04 16:35:17|2020-12-04|16:35:17
201|What’s happened? What.. I took a ran.|1742|0|2020-12-01 13:54:16|2020-12-01|13:54:16
202|Michael and Robbie They were in Year 3 when I joined, and now they were Year 6. They had grown into the fastest two kids in the school. And they couldn’t have been more different. Robbie was tall, skinny and good looking. He was naturally lazy and didn’t care to race all that much.|1742|0|2020-11-29 16:32:58|2020-11-29|16:32:58
203|Daniels' Running Formula (video for beginners)|1742|0|2020-11-27 16:50:52|2020-11-27|16:50:52
204|World Record - fastest Mile run with a stroller and kid 4:44!!!|1742|0|2020-11-24 01:20:52|2020-11-24|01:20:52
205|Skyrunning - Mountain running - Drone DJI Mavic Air|1742|0|2020-11-21 17:10:47|2020-11-21|17:10:47
206|Today's video is what you should be focusing on over the Winter and what to do in regards to Winter training. What do you do over winter? Image: Jason Dodd #wintertraining #yiannischristodoulou #training|1742|0|2020-11-21 16:33:02|2020-11-21|16:33:02
207|Should i take protein??|1742|2|2020-11-20 18:04:25|2020-11-20|18:04:25
208|Over 29 miles run in the Wings For Life World Run 2020. This year the race was a virtual event and I was running against the Catcher Car on an app. The car speeds up at certain intervals until the last person- the winner- is caught. It is a scary feeling to know that you are being hunted down...|1742|0|2020-11-15 16:33:09|2020-11-15|16:33:09
209|I can’t say the new school year started magnificently. It wasn’t like some Hollywood montage, but things did start to turn around. The nightmare Year 6 class had gone, and the staff room was moved, so the teachers no longer had to hear me scream.|1742|0|2020-11-12 16:32:31|2020-11-12|16:32:31
210|What an epic adventure! Cycling 505 miles, 10000m elevation, 39.5hrs moving time over 6 days with a 12.5mph average speed. Day 1 Dingwall (just outside Inverness) to Sheildaig: 90miles, 2000m including the infamous Applecross / Bealach na Bà pass (pass of cattle in Gaelic).|1742|0|2020-11-09 16:35:39|2020-11-09|16:35:39
212|Do you remember last year when we could run races in large groups? What was your favorite race pre-COVID?|1742|1|2020-11-08 14:35:16|2020-11-08|14:35:16
213|My last big race was approaching on September the 8th the National Aquathlon Championships. However leading up to this the weekend before I picked up a foot infection after competing at the triathlon sprint relays on the Sunday prior. My foot was hurting and inflamed straight after the race.|1742|0|2020-11-06 10:30:56|2020-11-06|10:30:56
214|One of these morning in the bankrupt city between Trail and Parkour run:|1742|0|2020-11-05 15:38:38|2020-11-05|15:38:38
215|LGBTQ+ VIRTUAL 5K 11/08/2020|1742|0|2020-11-02 18:26:08|2020-11-02|18:26:08
216|On the 4th October 2020 I took part in the Official London Marathon. This was not the London Marathon any of us had planned, and it is very sad that we were not on the start line together, but it is still an experience we can share together.|1742|0|2020-11-02 09:05:43|2020-11-02|09:05:43
217|5 weeks ago I took on the Lydney Lake 5K against The FOD Runner and ran 16:29 (https://youtu.be/9xwXTgIoX8o). A week later I tried again and took a step backwards running 16:55 (https://youtu.be/g6sRVQQrSgU). I have put 4 weeks of training in and now it is time to test if it has been working.|1742|0|2020-10-31 09:05:58|2020-10-31|09:05:58
218|I took part in the P24 which is a 24 hour race. I had to run an mile every hour for 24 hours. I managed to eat between running, I washed the dishes and hung out in the garden. I also set myself a goal to run a 5 minute mile each hour. Find out how I got on...|1742|0|2020-10-28 09:30:32|2020-10-28|09:30:32
219|Obviously a very strange time for everyone. I am finally, finally starting to feel human after 8 weeks of 100 mile weeks and 40-50 hours working.|1742|0|2020-10-25 09:03:57|2020-10-25|09:03:57
220|What is an Aquathlon and how to get started is my latest video with tips how to get into multi sport.|1742|0|2020-10-23 09:05:56|2020-10-23|09:05:56
221|If you live in Philip and china, run before my cats find you|1742|0|2020-10-18 21:20:02|2020-10-18|21:20:02
222|On the 12th September 2020 I took part in the Kew Garden 10k for the 4th year in a row. This year I went to race day already knowing that my plans and expectations would be changed, owing to the Covid 19 Global Pandemic.|1742|0|2020-10-15 08:09:52|2020-10-15|08:09:52
223|What is a good time for 1500 m run? Please give me some trick to be faster.|1742|1|2020-10-13 15:28:53|2020-10-13|15:28:53
224|The Elite London Marathon 2020 race was a fantastic spectacle. In this video I review my highlights of the race and what I thought of the Women's and Men's race. I also touch on the controversy over shoes and look at what different athletes were wearing.|1742|0|2020-10-12 07:35:24|2020-10-12|07:35:24
225|I'm so proud to be an Ambassador to NoblePro (the company behind the high spec treadmills and the one that I train on, the EliteE8i).|1742|0|2020-10-09 15:40:53|2020-10-09|15:40:53
226|The race starts. First mile is pretty flat, I am in third place. Then there are a few little uphill kicks, and I am down in 8th. We climb climb climb through the quarry and I’m not doing very well, slipping behind. Then we get onto the mountains proper.|1742|0|2020-10-08 15:41:38|2020-10-08|15:41:38
227|A different way to do some trail:|1742|0|2020-10-08 13:43:41|2020-10-08|13:43:41
228|GUYS GUYS GUYS!!!! LOOK AT THIS GLITCH|1742|0|2020-10-07 21:26:11|2020-10-07|21:26:11
229|I Ran The LONDON MARATHON 2020|1742|0|2020-10-05 20:54:25|2020-10-05|20:54:25
230|Nigel ran his Round in 1999, on the eve of the millennium. He covered 28 tors, 122km/ 76miles and 4000m/ 13000ft of vertical gain in 18hrs during the winter darkness. The Round gained interest during Lockdown when people looked closer to home for their challenges.|1742|0|2020-10-04 09:02:00|2020-10-04|09:02:00
231|Motivation can be hard to keep hold of at the best of times. However, when life is so uncertain and you don’t know what the future holds, it is particularly difficult.|1742|0|2020-09-25 07:38:03|2020-09-25|07:38:03
232|I was recently interviewed about my passion for running and my training so I thought I would post my answers for anyone that is interested. In future posts I will follow this up with interviews of some of the runners that inspire and motivate me.|1742|0|2020-09-25 07:05:07|2020-09-25|07:05:07
233|Today's video is about my recent RACE DAY at the Channel Sprint Triathlon outcome with a course record.....This was my first race in nearly a year, with race footage and analysis of how the day went I show you an insight to my day of racing. Stay safe guys in these tough times.|1742|0|2020-09-25 07:00:47|2020-09-25|07:00:47
234|First time running!|1742|0|2020-09-23 20:09:01|2020-09-23|20:09:01
235|Question: Is there any app tracks run and heart rate?|1742|0|2020-09-16 02:49:44|2020-09-16|02:49:44
236|Run in the Streets as if your Life was a Movie|1742|0|2020-09-08 17:13:34|2020-09-08|17:13:34
237|Looking for some new motivation? Mile Warriors has virtual running events for a cause.|1742|0|2020-09-08 02:25:15|2020-09-08|02:25:15
238|With the restrictions in place globally owing to the emergence of the Covid-19 pandemic, runners are looking for alternative ways to stay motivated.|1742|0|2020-09-06 09:01:42|2020-09-06|09:01:42
239|Ran David Goggins 4 4 48 challenge! Super hard challenge, the 4am runs definitely were a pain. Dehydrated with a 101 fever after the challenge was complete. Would definitely recommend to try with proper preparation!|1742|2|2020-09-04 23:31:28|2020-09-04|23:31:28
240|2002; I left University after one year, I wasn’t happy with my course, or the running group at Loughborough. I went home to London and got a job as a Teaching Assistant in a Primary School. A perfect job for me, at 21 years old.|1742|0|2020-09-02 08:30:40|2020-09-02|08:30:40
241|5:30 AM morning sunrise run in a small village in Vietnam. 4.2 kilometres or 2.6 miles.|1742|0|2020-09-01 14:40:29|2020-09-01|14:40:29
242|Sunday morning 6 AM run in the rice fields of Vietnam|1742|1|2020-08-30 02:56:35|2020-08-30|02:56:35
243|Running 1000M with NO TRAINING|1742|0|2020-08-24 15:16:31|2020-08-24|15:16:31
244|Do patella knee straps work?|1742|0|2020-08-20 14:36:31|2020-08-20|14:36:31
245|1 year and 4 months old running 1.2 kilometres or 0.6 miles in 21 minutes barefoot|1742|2|2020-08-18 03:48:57|2020-08-18|03:48:57
246|Running in the rain 5.6 kilometres or 3.4 miles in a small village in Vietnam|1742|0|2020-08-17 14:03:39|2020-08-17|14:03:39
247|How to train for a 5k|1742|1|2020-08-12 19:21:47|2020-08-12|19:21:47
248|In need of a post run stretching routine|1742|0|2020-08-11 20:48:40|2020-08-11|20:48:40
249|I recently found my runners high. Found this 90 second podcast about marathons. Thought i'd share :)|1742|0|2020-08-09 01:00:44|2020-08-09|01:00:44
250|My Running Motivation series continues with the fantastic Emma Joy, who writes her lipstickandtrainers.com. Emma is a personal trainer, coach and sub 4 hour Marathon runner. She has a great personality and as her blog implies, lipstick and trainers dont have to be mutually exclusive.|1742|0|2020-08-02 07:00:50|2020-08-02|07:00:50
251|Stamina and Endurance. If I run 2-3 miles everyday, how long will it take for my stamina and endurance to increase/get better?|1742|1|2020-07-12 00:24:13|2020-07-12|00:24:13
252|"How to run your first half marathon |Tips, workouts &amp; more. Are you dreaming about running your first half marathon? Free Program Included"|1742|0|2020-07-11 08:20:43|2020-07-11|08:20:43
253|The Mind-Clearing Magic of Running Explained By Neuroscience|1742|0|2020-06-30 07:40:51|2020-06-30|07:40:51
254|Is 15mph a fast sprint for a normal person?|1742|1|2020-06-23 15:42:03|2020-06-23|15:42:03
255|5K HOT!! Slow but fun 🏃🏻‍♂️🔥|1742|0|2020-06-12 03:34:20|2020-06-12|03:34:20
256|6 Tips to Boost Running Motivation|1742|0|2020-06-05 22:22:50|2020-06-05|22:22:50
257|Running for beginners !¡!¡|1742|1|2020-05-27 14:30:33|2020-05-27|14:30:33
258|nice spotify playlist mates like to use when we run|1742|0|2020-05-27 11:19:28|2020-05-27|11:19:28
259|👋 Any x-training ideas for muscles/groups that can help? TIA- Sits While Running|1742|3|2020-05-12 18:10:26|2020-05-12|18:10:26
260|Running Discord|1742|0|2020-05-09 20:52:50|2020-05-09|20:52:50
261|Run towards justice. #irunwithmaud|1742|1|2020-05-08 01:48:26|2020-05-08|01:48:26
262|[23F, fairly fit] hoping for advice/coaching.|1742|5|2020-04-29 17:50:59|2020-04-29|17:50:59
263|How dopey is the Dopey Challenge?|1742|0|2020-04-24 00:58:28|2020-04-24|00:58:28
264|Download free running books|1742|0|2020-03-22 12:06:08|2020-03-22|12:06:08
265|My progress in running.|1742|0|2020-03-14 12:40:16|2020-03-14|12:40:16
266|Running Motivation S01E02 - Run with Rachel|1742|0|2020-03-03 12:58:25|2020-03-03|12:58:25
267|Running Motivation S01E01 - Lets Get Going|1742|0|2020-03-01 12:16:06|2020-03-01|12:16:06
268|Farah And Salazar, The Definitive Guide|1742|0|2020-02-28 09:39:06|2020-02-28|09:39:06
269|Uiiir|1742|1|2020-02-27 15:56:26|2020-02-27|15:56:26
270|"If you find it's hard to get ""into"" running, try running with soup!!!"|1742|0|2020-02-26 13:03:18|2020-02-26|13:03:18
271|The World's First Hydroshirt for Runners - What's Your Take?|1742|4|2020-02-24 23:36:48|2020-02-24|23:36:48
272|If you find RUNNING is BORING, try running with food!!!!|1742|0|2020-02-24 12:53:33|2020-02-24|12:53:33
273|Onfire|1742|0|2020-02-02 12:49:23|2020-02-02|12:49:23
274|Please|1742|2|2020-02-02 07:04:16|2020-02-02|07:04:16
275|Shoes - size &amp; style|1742|1|2020-01-26 00:12:31|2020-01-26|00:12:31
276|Take Flight---Music: OYAHTT by The Coup. Font and color scheme inspired by the Boots Riley film 'Sorry To Bother You'|1742|0|2020-01-21 20:32:20|2020-01-21|20:32:20
277|London Relay 2019 - Run London, relay happiness|1742|1|2020-01-07 10:03:30|2020-01-07|10:03:30
278|Finsbury Park 5000s Review|1742|0|2019-12-24 10:30:57|2019-12-24|10:30:57
280|Crippling heart palpitations and shortness of breath while running|1742|2|2019-12-15 03:39:29|2019-12-15|03:39:29
281|Running pace calculator tool for mobile|1742|0|2019-12-12 19:08:03|2019-12-12|19:08:03
282|Hackney Half 2019|1742|0|2019-12-10 09:35:01|2019-12-10|09:35:01
283|Wireless Headphone recommendation|1742|0|2019-12-02 21:52:22|2019-12-02|21:52:22
284|Winter running|1742|1|2019-11-28 15:44:13|2019-11-28|15:44:13
285|WHY I WILL NEVER WEAR PERFORMANCE ENHANCING SHOES|1742|0|2019-11-22 20:09:24|2019-11-22|20:09:24
286|Has anyone heard of this brand?|1742|1|2019-11-20 16:35:41|2019-11-20|16:35:41
287|Incredible Sights and 5500+m of elevation in Greece at the Olympus Ultra|1742|2|2019-11-14 09:20:17|2019-11-14|09:20:17
288|Chicago 5k - Can I keep up with Paula Radclife|1742|0|2019-11-12 09:09:03|2019-11-12|09:09:03
289|Throw back to the Berlin Marathon 2019|1742|0|2019-11-09 15:31:43|2019-11-09|15:31:43
290|Going from a Miler to Marathon Runner|1742|0|2019-11-07 19:32:21|2019-11-07|19:32:21
291|Xc running. A HM in the middle of the nature, with lots of mud and hills, truly refreshing for the soul.|1742|0|2019-10-30 00:34:05|2019-10-30|00:34:05
292|Fuck da jumping goat|1742|0|2019-10-29 07:36:34|2019-10-29|07:36:34
293|15 year old runs first marathon|1742|0|2019-10-27 04:40:30|2019-10-27|04:40:30
294|Motivation|1742|0|2019-10-26 17:21:41|2019-10-26|17:21:41
295|180+ bpm music|1742|2|2019-10-16 12:57:42|2019-10-16|12:57:42
296|Finally did it, my first 5k under 19m. Next goal is to run 10k under 40, target is 37m. Was wearing just a watch heart sensor, I guess that's why the average bpm was so low.|1742|0|2019-10-08 19:37:58|2019-10-08|19:37:58
297|A product review for a towel that keeps you cool while you run!|1742|0|2019-09-04 17:43:45|2019-09-04|17:43:45
298|Wife can you pay bills. You see $473,5855|1742|0|2019-08-22 13:46:38|2019-08-22|13:46:38
299|Great race yesterday|1742|3|2019-07-28 19:43:16|2019-07-28|19:43:16
300|Favorite road I run, Quilcene, WA|1742|4|2019-06-27 23:46:09|2019-06-27|23:46:09
301|Could a Gut Bacteria Supplement Make Us Run Faster?|1742|0|2019-06-26 18:41:45|2019-06-26|18:41:45
302|Ran my first 20k!|1742|0|2019-05-07 07:08:47|2019-05-07|07:08:47
303|New Treadmill app named Treadmill TV. Any thoughts? The scenery looks intriguing!!!|1742|0|2019-04-13 16:51:32|2019-04-13|16:51:32
304|Tips to increase endurance for running|1742|2|2019-04-03 09:28:47|2019-04-03|09:28:47
305|What do you think is important when traveling for a race? Spend 1 minute and help me chase my dream!|1742|0|2019-04-03 18:57:37|2019-04-03|18:57:37
306|Is running on a treadmill easier than running on the road?|1742|0|2019-03-24 08:12:26|2019-03-24|08:12:26
307|SOLVED: Woman lacking motivation.|1742|0|2019-03-22 14:21:51|2019-03-22|14:21:51
308|This is why you should be running|1742|0|2019-03-06 21:12:27|2019-03-06|21:12:27
309|Is this part of your training regime? It should be.|1742|3|2019-01-28 14:14:19|2019-01-28|14:14:19
310|Fitness 101: 8 Tricks To Up Your Running Game|1742|0|2019-01-22 07:42:29|2019-01-22|07:42:29
311|Why Anyone Can Run an Ultra Marathon|1742|0|2019-01-14 18:13:47|2019-01-14|18:13:47
313|5 Money Making Ways with 0 Skills. Good Morning! I am 2 days into my video editing journey (of course my content is gaming) please give me feedback of what i can improve. Feedback is most valuable|1742|0|2018-12-17 08:57:13|2018-12-17|08:57:13
314|Rate my project — Sportnomad.net — a place to find any race in the world|1742|1|2018-12-10 15:05:07|2018-12-10|15:05:07
315|부천오피∈ⓡⓤⓝⓑⓔⓢⓣ①⑥↔ⓝⓔⓣ∋리얼후기♨부천안마클럽▣부천오피위치¤런피플분당키스방▒부천건마후리기┒부천휴게텔주소|1742|0|2018-12-03 16:23:00|2018-12-03|16:23:00
316|Run &amp; cellulite|1742|0|2018-11-23 16:42:24|2018-11-23|16:42:24
317|I honestly feel one run can drastically shift your mentality|1742|0|2018-10-30 05:54:57|2018-10-30|05:54:57
318|Is running a sub 20 5k a realistic goal for me?|1742|1|2018-10-29 23:02:08|2018-10-29|23:02:08
319|1.5 mile run|1742|3|2018-10-16 20:17:27|2018-10-16|20:17:27
320|1500m Pace Track Workout|1742|0|2018-10-04 15:18:56|2018-10-04|15:18:56
321|I started running because I want to take on the One Punch Man workout, which consist of 100 push ups, 100 sit-ups, 100 squats and 10 km run. I did 5 km a day for 7 days then jumped into this workout. Here is a video that I made talking about the whole experience if you are curious!|1742|1|2018-09-19 02:54:33|2018-09-19|02:54:33
322|Numbness|1742|1|2018-09-18 14:38:44|2018-09-18|14:38:44
323|Trail stairs! You know it's going to be a tough run when it starts off like this...|1742|0|2018-09-17 18:40:52|2018-09-17|18:40:52
324|Anyone know what to do about toes going numb?|1742|1|2018-09-14 02:24:42|2018-09-14|02:24:42
325|Hey Runners! We need to learn about winter running and could use your help. Click the link below to fill out a quick survey. https://goo.gl/forms/EmIsYrhPzJe5EREP2|1742|0|2018-09-06 02:11:26|2018-09-06|02:11:26
326|Hey Runners! We're a group of students doing research on winter running and need your running knowledge! Click the link below to fill out a quick survey. https://goo.gl/forms/EmIsYrhPzJe5EREP2|1742|0|2018-09-06 00:42:48|2018-09-06|00:42:48
327|Does being grateful lead to better performance?|1742|0|2018-08-29 02:37:22|2018-08-29|02:37:22
328|As a first time runner, I tried running 5 kms a day for 7 days, here is what happened|1742|0|2018-08-19 15:51:14|2018-08-19|15:51:14
329|5K Treadmill Training Tips|1742|0|2018-08-08 19:02:58|2018-08-08|19:02:58
330|Here are some tips about nutrition for runners I thought up. Comment if you think I said something wrong or incorrect.|1742|0|2018-07-27 17:17:26|2018-07-27|17:17:26
331|Watch Live: Alex Jones Confronts Bernie Sanders and He Runs!!|1742|0|2018-06-07 02:39:50|2018-06-07|02:39:50
332|chest pain during runs|1742|4|2018-04-08 15:42:10|2018-04-08|15:42:10
333|Running questions.. Maybe Ive been doing it wrong? Asthma?|1742|0|2018-03-24 15:07:16|2018-03-24|15:07:16
334|Shoes and the Dreaded Heel-Strike|1742|0|2018-03-12 14:29:38|2018-03-12|14:29:38
335|RUNNER FLEXX|1742|0|2018-03-11 12:00:01|2018-03-11|12:00:01
