|title|subreddit_subscribers|num_comments|create_date|new_date|new_time
280|First Half Marathon - NYRR Staten Island Half 2023 - 1:52|2684024|15|2023-10-11 04:26:10|2023-10-11|04:26:10
281|Chicago Marathon - First Marathon Report - so many lessons learned|2684024|14|2023-10-10 21:35:45|2023-10-10|21:35:45
282|Ran my first marathon!|2684024|37|2023-10-10 15:20:46|2023-10-10|15:20:46
283|BoA Chicago Marathon 2023: Bad Day to be a Record|2684024|16|2023-10-10 17:56:31|2023-10-10|17:56:31
285|Official Q&amp;A for Wednesday, October 11, 2023|2684024|223|2023-10-11 04:01:12|2023-10-11|04:01:12
286|[Skagen Marathon, Denmark] My first Half Marathon - Hardest physical thing I have ever done|2684024|26|2023-10-10 15:55:08|2023-10-10|15:55:08
287|Achievements for Wednesday, October 11, 2023|2684024|27|2023-10-11 04:01:12|2023-10-11|04:01:12
289|First Half Marathon (Royal Victoria Marathon)|2684024|25|2023-10-10 17:03:15|2023-10-10|17:03:15
290|Chester Marathon 2023: Race Report - 18 and a half minute PB!|2684024|5|2023-10-10 08:26:27|2023-10-10|08:26:27
292|Race Report: Chicago Marathon. 7th marathon. BQ and 5min PR.|2684024|43|2023-10-09 15:55:25|2023-10-09|15:55:25
293|Achievements for Tuesday, October 10, 2023|2684024|43|2023-10-10 04:01:09|2023-10-10|04:01:09
294|What is your go to cross training. Mine is Kettlebell.|2684024|138|2023-10-09 13:32:30|2023-10-09|13:32:30
295|Chester Marathon 2023: 30-Minute Marathon PB|2684024|8|2023-10-09 20:58:34|2023-10-09|20:58:34
296|Official Q&amp;A for Tuesday, October 10, 2023|2684024|212|2023-10-10 04:01:08|2023-10-10|04:01:08
298|Bank of America Chicago Marathon: My First Marathon!|2684024|5|2023-10-09 18:11:51|2023-10-09|18:11:51
299|Soon to be dad, first marathon heightened awareness of my own mortality, Dr check up?|2684024|104|2023-10-09 10:57:33|2023-10-09|10:57:33
300|[Bournemouth Half Marathon] My first Official Race - hot and humid but a PB|2684024|16|2023-10-09 19:02:42|2023-10-09|19:02:42
302|My first ever marathon (Munich marathon)|2684024|25|2023-10-09 08:02:36|2023-10-09|08:02:36
303|First Half Marathon! Falmouth MA|2684024|4|2023-10-09 12:18:38|2023-10-09|12:18:38
304|Transjeju Jeju50k - what a different beast trail races are!|2684024|8|2023-10-09 12:20:57|2023-10-09|12:20:57
305|Running bras while breastfeeding|2684024|20|2023-10-09 16:56:55|2023-10-09|16:56:55
306|Jack Daniels Running Formula|2684024|22|2023-10-09 12:51:21|2023-10-09|12:51:21
307|Online running coach|2684024|13|2023-10-09 15:53:54|2023-10-09|15:53:54
308|The Great Balloon Chase 1/2 Marathon (or how I accidentally won my first race)|2684024|20|2023-10-08 22:33:04|2023-10-08|22:33:04
310|Chicago Marathon Results Discussion|2684024|176|2023-10-08 14:48:08|2023-10-08|14:48:08
311|First Marathon Race Report!|2684024|14|2023-10-08 22:51:37|2023-10-08|22:51:37
312|Janji rainrunner 2.0|2684024|1|2023-10-09 18:26:18|2023-10-09|18:26:18
313|Official Q&amp;A for Monday, October 09, 2023|2684024|169|2023-10-09 04:01:11|2023-10-09|04:01:11
315|Suggestions for first marathon in New England?|2684024|31|2023-10-09 00:53:43|2023-10-09|00:53:43
316|Achievements for Monday, October 09, 2023|2684024|57|2023-10-09 04:01:12|2023-10-09|04:01:12
317|How to run in winter with a hydration vest?|2684024|108|2023-10-08 13:42:50|2023-10-08|13:42:50
318|What do you do with all your race swag?|2684024|70|2023-10-08 13:36:36|2023-10-08|13:36:36
319|Best hydration vests for petite runners|2684024|5|2023-10-08 17:48:54|2023-10-08|17:48:54
320|Route Mapping?|2684024|11|2023-10-08 17:11:10|2023-10-08|17:11:10
321|Ever use a Keel watch badge?|2684024|5|2023-10-09 02:19:17|2023-10-09|02:19:17
322|First Half Marathon in Cape Cod|2684024|17|2023-10-08 00:43:29|2023-10-08|00:43:29
323|First Invitational High School 5K!!!|2684024|15|2023-10-08 00:36:08|2023-10-08|00:36:08
324|Running a sub-20 5k on 6 weeks training - lessons learned|2684024|45|2023-10-07 13:04:25|2023-10-07|13:04:25
325|Achievements for Sunday, October 08, 2023|2684024|98|2023-10-08 04:01:10|2023-10-08|04:01:10
326|Race suggestions in or around San Francisco|2684024|20|2023-10-08 03:38:22|2023-10-08|03:38:22
328|Official Q&amp;A for Sunday, October 08, 2023|2684023|130|2023-10-08 04:01:10|2023-10-08|04:01:10
329|Marathon Running Coach Advice -- Need Help Finding a Good Coach|2684023|11|2023-10-07 16:55:43|2023-10-07|16:55:43
330|10km Time Trial (Tune-Up Race) in Pfitz 12/70 Marathon Training|2684023|7|2023-10-07 16:28:46|2023-10-07|16:28:46
331|Headphones for cold weather|2684023|6|2023-10-08 02:22:18|2023-10-08|02:22:18
332|Hawaii Run Groups|2684023|2|2023-10-07 21:46:41|2023-10-07|21:46:41
333|Boulderthon Honoring Twin Cities Marathon Bibs|2684023|3|2023-10-06 19:33:42|2023-10-06|19:33:42
335|Achievements for Saturday, October 07, 2023|2684023|62|2023-10-07 04:01:14|2023-10-07|04:01:14
336|Official Q&amp;A for Saturday, October 07, 2023|2684023|120|2023-10-07 04:01:12|2023-10-07|04:01:12
337|Running in Singapore|2684023|90|2023-10-06 15:30:02|2023-10-06|15:30:02
338|My first half! Ann Arbor Probility Half Marathon Report|2684023|3|2023-10-06 21:27:44|2023-10-06|21:27:44
339|The Weekend Thread -- 6th October 2023|2684023|107|2023-10-06 12:03:03|2023-10-06|12:03:03
340|Berlin Marathon Tour Operator - Theretorun/Trotandoando|2684023|2|2023-10-06 15:22:22|2023-10-06|15:22:22
343|Running with a dog?|2684023|198|2023-10-05 19:15:46|2023-10-05|19:15:46
344|A harrowing first marathon in Loch Ness|2684023|57|2023-10-05 14:57:55|2023-10-05|14:57:55
345|Official Q&amp;A for Friday, October 06, 2023|2684023|235|2023-10-06 04:01:11|2023-10-06|04:01:11
346|Achievements for Friday, October 06, 2023|2684023|21|2023-10-06 04:01:12|2023-10-06|04:01:12
347|"2023 Köln Half Marathon Race Report - The ""Delete Facebook, Hit The Gym"" Edition"|2684023|25|2023-10-05 13:42:01|2023-10-05|13:42:01
348|Tips for hosting a group run at a conference?|2684023|41|2023-10-05 16:11:02|2023-10-05|16:11:02
349|I ran my first marathon on my birthday! Wineglass Marathon - Race Report|2684023|26|2023-10-04 23:50:39|2023-10-04|23:50:39
350|Running routes in St. Augustine|2684023|6|2023-10-05 12:15:24|2023-10-05|12:15:24
352|Race Report: Chicago Half - Didn't Poo, Didn't Blackout!|2684024|22|2023-10-04 21:39:47|2023-10-04|21:39:47
353|Recommendation for marathons in the spring for first timer|2684024|107|2023-10-04 23:51:41|2023-10-04|23:51:41
354|Favorite Mash-Up Songs for Races and Hard Workouts|2684024|70|2023-10-04 19:57:35|2023-10-04|19:57:35
355|Cologne Half Marathon (sub 1h50 after not running for 7 Months)(male 40+)|2684024|9|2023-10-04 21:30:03|2023-10-04|21:30:03
356|Achievements for Thursday, October 05, 2023|2684024|13|2023-10-05 04:01:11|2023-10-05|04:01:11
357|Official Q&amp;A for Thursday, October 05, 2023|2684024|132|2023-10-05 04:01:09|2023-10-05|04:01:09
358|Race Report: Bury 10k|2684024|7|2023-10-04 13:51:42|2023-10-04|13:51:42
359|Gels with natural ingredients?|2684024|49|2023-10-05 00:20:24|2023-10-05|00:20:24
360|Kuala Lumpur Standard Chartered Marathon 2023: A Humbling Experience and Lessons Learned|2684024|31|2023-10-04 06:42:12|2023-10-04|06:42:12
361|Favorite men’s winter running outer layers?|2684024|65|2023-10-04 02:38:33|2023-10-04|02:38:33
362|Race Report : Wineglass Marathon|2684024|61|2023-10-03 14:04:22|2023-10-03|14:04:22
363|Official Q&amp;A for Wednesday, October 04, 2023|2684024|168|2023-10-04 04:01:13|2023-10-04|04:01:13
364|How many races did you run before you volunteered at one? And what's your favorite volunteering story?|2684024|67|2023-10-03 17:44:18|2023-10-03|17:44:18
365|Achievements for Wednesday, October 04, 2023|2684024|16|2023-10-04 04:01:14|2023-10-04|04:01:14
368|Custom singlet / T-shirt for a marathon|2684024|3|2023-10-04 04:14:23|2023-10-04|04:14:23
370|Portland Half Marathon, my first half ever! And it went great!|2684024|14|2023-10-02 23:56:51|2023-10-02|23:56:51
372|Official Q&amp;A for Tuesday, October 03, 2023|2684024|308|2023-10-03 04:01:10|2023-10-03|04:01:10
373|Race Report - Petit Train du Nord Marathon|2684024|6|2023-10-03 00:20:29|2023-10-03|00:20:29
374|Achievements for Tuesday, October 03, 2023|2684024|21|2023-10-03 04:01:11|2023-10-03|04:01:11
376|Portland Marathon, my first|2684024|10|2023-10-02 23:29:12|2023-10-02|23:29:12
377|Berlin Marathon 2023 - A Disappointing First Marathon|2684024|39|2023-10-02 19:09:52|2023-10-02|19:09:52
378|Tokyo ballot results today|2684024|56|2023-10-02 15:22:32|2023-10-02|15:22:32
379|Experience with Fleet Feet running program?|2684024|33|2023-10-02 15:16:12|2023-10-02|15:16:12
380|Ann Arbor Probility Half Marathon Report|2684024|20|2023-10-02 13:20:15|2023-10-02|13:20:15
381|Comparing Water/Sweat Resistance: JBL Endurance Peak 3 (IP68) vs. Bone Conduction Headphones (IPX8)|2684024|2|2023-10-03 09:04:34|2023-10-03|09:04:34
383|Race Report: Standard Chartered KL Half-Marathon (First Time)|2684024|4|2023-10-02 08:59:15|2023-10-02|08:59:15
384|World Half Marathon Championships Race Report|2684024|1|2023-10-02 05:57:37|2023-10-02|05:57:37
385|Race report: My first Half-Marathon|2684024|7|2023-10-02 06:42:46|2023-10-02|06:42:46
386|Twin Cities Marathon cancelled due to heat. Do you think cancelling a race a couple hours before the start time is appropriate?|2684024|575|2023-10-01 10:56:38|2023-10-01|10:56:38
387|Race Report: Akron Marathon (First Time)|2684024|16|2023-10-01 21:19:56|2023-10-01|21:19:56
388|Advice on starting a running club.|2684024|31|2023-10-01 21:18:33|2023-10-01|21:18:33
389|San Jose RnR Half Marathon - Again a Year Later|2684024|6|2023-10-02 05:29:24|2023-10-02|05:29:24
390|Race Report: Glasgow Half Marathon - Great Scottish Run|2684024|24|2023-10-01 20:38:03|2023-10-01|20:38:03
391|Race Report: First ever Half-Marathon in Cologne, Germany|2684024|4|2023-10-01 17:35:33|2023-10-01|17:35:33
392|Achievements for Monday, October 02, 2023|2684024|46|2023-10-02 04:01:16|2023-10-02|04:01:16
393|Official Q&amp;A for Monday, October 02, 2023|2684024|242|2023-10-02 04:01:15|2023-10-02|04:01:15
395|Long distance running routes|2684024|17|2023-10-01 15:58:12|2023-10-01|15:58:12
396|Colorado Springs Half Marathon: A PR and my first negative split, all at 6000 feet!|2684024|19|2023-09-30 22:56:57|2023-09-30|22:56:57
397|Achievements for Sunday, October 01, 2023|2684024|122|2023-10-01 04:01:17|2023-10-01|04:01:17
399|Official Q&amp;A for Sunday, October 01, 2023|2684024|140|2023-10-01 04:01:15|2023-10-01|04:01:15
400|September Monthly Updates &amp; Check In Thread|2684024|11|2023-10-01 05:01:47|2023-10-01|05:01:47
401|What are your favourite cold weather baselayers?|2684024|104|2023-09-30 11:44:33|2023-09-30|11:44:33
402|Official Q&amp;A for Saturday, September 30, 2023|2684024|128|2023-09-30 04:01:13|2023-09-30|04:01:13
403|Achievements for Saturday, September 30, 2023|2684024|112|2023-09-30 04:01:14|2023-09-30|04:01:14
404|[YSK] If you tense up your shoulders when running, core exercises can help!|2684024|3|2023-09-30 02:38:46|2023-09-30|02:38:46
405|Training for an ultra with no support people|2684024|27|2023-09-29 19:24:23|2023-09-29|19:24:23
406|Nagging tight calves? Ask for imaging|2684024|5|2023-09-30 00:33:53|2023-09-30|00:33:53
407|Running headlamp for Seattle, waterproof with rear red light|2684024|17|2023-09-30 06:41:56|2023-09-30|06:41:56
408|Race Report: Mill Race Half Marathon, Columbus, IN, USA|2684024|19|2023-09-29 15:47:44|2023-09-29|15:47:44
410|Race Report - Robin Hood Half Marathon - My First EVER Half Marathon|2684024|26|2023-09-29 10:03:20|2023-09-29|10:03:20
411|The Weekend Thread -- 29th September 2023|2684024|114|2023-09-29 12:49:16|2023-09-29|12:49:16
413|Boston Marathon Cutoff Announced as 5:29|2684024|190|2023-09-28 14:14:30|2023-09-28|14:14:30
414|Race Report: Berlin Marathon (my very first one)|2684024|13|2023-09-28 19:22:24|2023-09-28|19:22:24
415|Race Report: Montreal Marathon (First Marathon)|2684024|14|2023-09-28 19:05:28|2023-09-28|19:05:28
416|Achievements for Friday, September 29, 2023|2684024|31|2023-09-29 04:01:11|2023-09-29|04:01:11
417|Official Q&amp;A for Friday, September 29, 2023|2684024|188|2023-09-29 04:01:10|2023-09-29|04:01:10
419|Looking for a marathon in the Southeast U.S this spring|2684024|42|2023-09-28 19:30:26|2023-09-28|19:30:26
420|patagonia repairs|2684024|3|2023-09-28 19:52:46|2023-09-28|19:52:46
422|Race organizers: what's your go to website for ordering race day giveaways?|2684024|4|2023-09-28 16:06:17|2023-09-28|16:06:17
423|Favorite hat for all my heavy sweaters out there?|2684024|68|2023-09-28 04:53:16|2023-09-28|04:53:16
424|Newport Liberty Half - First half-marathon for a back-of-the-pack runner in a tropical rainstorm!|2684024|11|2023-09-27 19:02:51|2023-09-27|19:02:51
425|Official Q&amp;A for Thursday, September 28, 2023|2684024|209|2023-09-28 04:01:09|2023-09-28|04:01:09
426|Achievements for Thursday, September 28, 2023|2684024|18|2023-09-28 04:01:10|2023-09-28|04:01:10
427|Montreal's Marathon - You get the race you prepare for|2684024|41|2023-09-27 13:45:18|2023-09-27|13:45:18
428|Good place to run in Lexington, KY?|2684024|22|2023-09-27 17:30:06|2023-09-27|17:30:06
429|Running routes in Oahu.|2684024|12|2023-09-27 16:58:23|2023-09-27|16:58:23
430|Berlin Marathon 2023 - Hydration Systems Update|2684024|4|2023-09-27 17:48:22|2023-09-27|17:48:22
431|Race Recap-Golden Leaf Half Marathon aka Run Straight up a Ski slope|2684024|8|2023-09-26 20:15:39|2023-09-26|20:15:39
434|Official Q&amp;A for Wednesday, September 27, 2023|2684024|203|2023-09-27 04:01:10|2023-09-27|04:01:10
435|Achievements for Wednesday, September 27, 2023|2684024|36|2023-09-27 04:01:11|2023-09-27|04:01:11
436|Taking Voice Notes / Dictation While Running?|2684024|15|2023-09-27 01:41:02|2023-09-27|01:41:02
437|Marathon de Montréal race report|2684024|7|2023-09-26 14:59:24|2023-09-26|14:59:24
438|[Race Report] First 10K - Pittsburgh's Great Race|2684024|3|2023-09-26 13:44:15|2023-09-26|13:44:15
439|Iliopsoas centered running? Is it a good style?|2684024|9|2023-09-26 16:35:23|2023-09-26|16:35:23
442|Have any of you done the 5K improvement program on Runna and how did it go when you sent it at the end?|2684024|61|2023-09-26 12:05:21|2023-09-26|12:05:21
443|Racing with a significant other|2684024|31|2023-09-25 23:29:10|2023-09-25|23:29:10
444|What did XC running look like for you?|2684024|74|2023-09-25 18:33:17|2023-09-25|18:33:17
446|Achievements for Tuesday, September 26, 2023|2684024|22|2023-09-26 04:01:11|2023-09-26|04:01:11
447|Official Q&amp;A for Tuesday, September 26, 2023|2684024|212|2023-09-26 04:01:10|2023-09-26|04:01:10
448|Help Wanted! Creating a metric to compare runs|2684024|34|2023-09-25 21:20:50|2023-09-25|21:20:50
450|Pacing advice? Living at altitude, racing at sea level|2684024|7|2023-09-25 16:20:31|2023-09-25|16:20:31
451|First Marathon Race Report: Montréal 2023|2684024|9|2023-09-25 14:10:57|2023-09-25|14:10:57
452|Do you / How do you display all your race bibs|2684024|126|2023-09-25 02:42:40|2023-09-25|02:42:40
453|Lisbon Marathon|2684024|18|2023-09-25 10:46:07|2023-09-25|10:46:07
454|22 and coping with never running again|2684024|77|2023-09-24 15:49:48|2023-09-24|15:49:48
455|Dublin Half Marathon|2684024|10|2023-09-24 21:17:23|2023-09-24|21:17:23
456|My Experiment With MAF Method Training|2684024|85|2023-09-24 15:39:17|2023-09-24|15:39:17
457|Official Q&amp;A for Monday, September 25, 2023|2684024|251|2023-09-25 04:01:17|2023-09-25|04:01:17
459|Achievements for Monday, September 25, 2023|2684024|42|2023-09-25 04:01:18|2023-09-25|04:01:18
460|Nutrition for 12+ hour runs?|2684024|10|2023-09-24 19:04:32|2023-09-24|19:04:32
461|Marine Corps Marathon Hydration|2684024|18|2023-09-24 14:44:01|2023-09-24|14:44:01
462|traveling to sacramento ... help finding safe areas to run|2684024|10|2023-09-24 22:20:42|2023-09-24|22:20:42
463|Runners who get cold easy|2684024|44|2023-09-24 14:09:21|2023-09-24|14:09:21
464|Fun running routes in Boston? Due to run 19/20 miles next weekend and never been to Boston before!|2684024|42|2023-09-24 01:38:43|2023-09-24|01:38:43
465|Achievements for Sunday, September 24, 2023|2684024|121|2023-09-24 04:01:14|2023-09-24|04:01:14
466|Recommend me a fall/winter road half in western US?|2684024|17|2023-09-24 17:39:42|2023-09-24|17:39:42
468|GI issues &amp; anxiety/stress?|2684024|61|2023-09-23 21:19:08|2023-09-23|21:19:08
469|Official Q&amp;A for Sunday, September 24, 2023|2684024|137|2023-09-24 04:01:12|2023-09-24|04:01:12
470|Hubris to Humility, or how I learned to love the race. My First Marathon.|2684024|50|2023-09-22 19:39:37|2023-09-22|19:39:37
471|Berlin predictions?|2684024|33|2023-09-23 02:42:17|2023-09-23|02:42:17
472|Water Station Volunteer|2684024|19|2023-09-22 22:10:02|2023-09-22|22:10:02
473|Best road races in Australia?|2684024|18|2023-09-23 02:55:19|2023-09-23|02:55:19
474|How to support a friend who’s out of the game for a while|2684024|44|2023-09-22 15:46:56|2023-09-22|15:46:56
475|Achievements for Saturday, September 23, 2023|2684024|129|2023-09-23 04:01:15|2023-09-23|04:01:15
476|Official Q&amp;A for Saturday, September 23, 2023|2684024|156|2023-09-23 04:01:14|2023-09-23|04:01:14
478|VOOST vs NUUN Hydration Tablet Showdown 2k23|2684024|28|2023-09-22 16:53:01|2023-09-22|16:53:01
479|How on earth do I carb load 600grams a day!!|2684024|92|2023-09-22 07:30:22|2023-09-22|07:30:22
480|The Weekend Thread — 22nd September 2023|2684024|77|2023-09-22 12:18:30|2023-09-22|12:18:30
481|Sydney Marathon - First time runner|2684024|23|2023-09-22 01:50:53|2023-09-22|01:50:53
482|Download All TCX Running History from Mapmyrun|2684024|3|2023-09-22 10:51:00|2023-09-22|10:51:00
485|Achievements for Friday, September 22, 2023|2684024|48|2023-09-22 04:01:14|2023-09-22|04:01:14
486|Official Q&amp;A for Friday, September 22, 2023|2684024|192|2023-09-22 04:01:12|2023-09-22|04:01:12
487|Average 10k runner here. Where to start on sprint training?|2684024|95|2023-09-21 09:16:18|2023-09-21|09:16:18
488|New to running or the sub? Click here first! Looking for links to the most recent weekly threads or other mega-threads, this is the spot!|2684024|56|2023-09-21 15:10:58|2023-09-21|15:10:58
489|Desperately Looking For The Least Uncomfortable HR Chest Strap|2684024|128|2023-09-21 11:50:24|2023-09-21|11:50:24
491|Orca Half - Tried a lot of new things on race day. Oops|2684024|25|2023-09-20 19:40:34|2023-09-20|19:40:34
492|City-bay Half Marathon. My First Half Marathon Journey!|2684024|3|2023-09-21 02:52:36|2023-09-21|02:52:36
493|Official Q&amp;A for Thursday, September 21, 2023|2684024|216|2023-09-21 04:01:09|2023-09-21|04:01:09
494|For long running|2684024|0|2023-09-21 14:18:40|2023-09-21|14:18:40
495|What Running Series exist out there?|2684024|74|2023-09-20 17:56:46|2023-09-20|17:56:46
496|Achievements for Thursday, September 21, 2023|2684024|32|2023-09-21 04:01:10|2023-09-21|04:01:10
497|Oahu - Long Run|2684024|12|2023-09-20 18:43:32|2023-09-20|18:43:32
498|Short Running Route in Warsaw|2684024|12|2023-09-20 14:05:49|2023-09-20|14:05:49
499|5 Race / Town Event -Huge Milestone|2684024|4|2023-09-20 04:54:30|2023-09-20|04:54:30
500|Pacific Northwest Marathon. First 1/2 in 5 years! Sub 1:40 goal hit!|2684024|30|2023-09-19 17:32:26|2023-09-19|17:32:26
501|Achievements for Wednesday, September 20, 2023|2684024|40|2023-09-20 04:01:26|2023-09-20|04:01:26
502|Official Q&amp;A for Wednesday, September 20, 2023|2684024|188|2023-09-20 04:01:25|2023-09-20|04:01:25
505|A Non-Runner Becomes....Kind of a Runner? Belfast Half Marathon|2684024|21|2023-09-19 09:36:14|2023-09-19|09:36:14
506|Sydney Marathon 2023: An amazing experince|2684024|6|2023-09-19 11:43:55|2023-09-19|11:43:55
507|The road from 100+ kg whale to sub 2 hrs HM in just 8 months|2684024|129|2023-09-18 14:30:15|2023-09-18|14:30:15
508|"Books similar to ""The Lost Art of Running"", ""Out Of Thin Air"" and Adharanand Finn"|2684024|16|2023-09-19 05:45:40|2023-09-19|05:45:40
509|Sub-3 Ladies?|2684024|92|2023-09-18 20:58:06|2023-09-18|20:58:06
511|Sydney Marathon 2023 - Hot Girl Summer Came Early|2684024|5|2023-09-19 04:07:38|2023-09-19|04:07:38
513|Effective/efficient goal setting|2684024|55|2023-09-19 00:25:45|2023-09-19|00:25:45
515|Official Q&amp;A for Tuesday, September 19, 2023|2684024|283|2023-09-19 04:01:13|2023-09-19|04:01:13
516|DC Half Training Race into a PR|2684024|3|2023-09-18 20:09:41|2023-09-18|20:09:41
517|Ragnar Reach the Beach 2023 Road Relay|2684024|14|2023-09-18 19:50:20|2023-09-18|19:50:20
518|NYRR Bronx 10 mile - First Race Report!|2684024|6|2023-09-18 15:42:48|2023-09-18|15:42:48
519|Achievements for Tuesday, September 19, 2023|2684024|13|2023-09-19 04:01:15|2023-09-19|04:01:15
520|Running mums - when does it get easier?|2684024|52|2023-09-18 10:35:52|2023-09-18|10:35:52
521|The US Armed Forces created an Armed Forces Series Challenge incorporating the official races from each branch.|2684024|2|2023-09-18 18:17:01|2023-09-18|18:17:01
522|Race Report: Fox Valley Half Marathon - my first half marathon|2684024|18|2023-09-18 13:54:33|2023-09-18|13:54:33
523|Berlin Marathon US Broadcast?|2684024|10|2023-09-18 18:32:21|2023-09-18|18:32:21
524|Great North Run 2023|2684024|5|2023-09-18 20:07:36|2023-09-18|20:07:36
525|Race Report: Sydney (half) Marathon - running grumpy|2684024|8|2023-09-18 11:06:15|2023-09-18|11:06:15
526|RunReigate Half Report|2684024|1|2023-09-18 14:38:23|2023-09-18|14:38:23
528|Race Report: Sydney Marathon - Injured, No training, Covid, Heatwave, but still did it|2684024|13|2023-09-18 06:33:23|2023-09-18|06:33:23
529|Race Report: Belfast Half Marathon - PB!|2684024|1|2023-09-18 10:24:39|2023-09-18|10:24:39
530|Heat lessons from Sydney, 2023|2684024|6|2023-09-18 04:12:32|2023-09-18|04:12:32
531|Race Report: Ranger Challenge Run 21.1 km - New PB!|2684024|4|2023-09-18 10:21:35|2023-09-18|10:21:35
532|My Second DC Half Marathon: A Solid PR on the Way to my First Marathon|2684024|21|2023-09-17 20:13:43|2023-09-17|20:13:43
533|Achievements for Monday, September 18, 2023|2684024|29|2023-09-18 04:01:17|2023-09-18|04:01:17
534|Official Q&amp;A for Monday, September 18, 2023|2684024|268|2023-09-18 04:01:15|2023-09-18|04:01:15
536|Race report- Philly PDR (13.1): Journey from cardio-hating newbie to long distance lover + COVID recovery|2684024|18|2023-09-17 20:27:15|2023-09-17|20:27:15
537|Race Report: Sydney Marathon - Racing the Heat|2684024|69|2023-09-17 10:12:41|2023-09-17|10:12:41
538|Virgil Crest 100- 2nd Place-Race Report|2684024|6|2023-09-17 14:18:52|2023-09-17|14:18:52
539|Uk fast marathons|2684024|41|2023-09-17 12:05:17|2023-09-17|12:05:17
540|#3 and #4 fastest miles in history run at Prefontaine Classic (fastest in 24 years)|2684024|30|2023-09-16 22:30:06|2023-09-16|22:30:06
541|1st Race Ever (4 Miler)|2684024|12|2023-09-16 20:50:59|2023-09-16|20:50:59
542|Running in Manhattan - Etiquette, Safety, Tips?|2684024|30|2023-09-16 20:38:03|2023-09-16|20:38:03
543|Achievements for Sunday, September 17, 2023|2684024|101|2023-09-17 04:01:12|2023-09-17|04:01:12
544|Official Q&amp;A for Sunday, September 17, 2023|2684024|178|2023-09-17 04:01:11|2023-09-17|04:01:11
546|Indy Monumental 2023|2684024|25|2023-09-16 19:51:14|2023-09-16|19:51:14
547|What’s your recommendation for a must do running trip?|2684024|18|2023-09-16 23:48:11|2023-09-16|23:48:11
548|Halloween races are coming! Costume ideas!|2684024|49|2023-09-16 03:55:44|2023-09-16|03:55:44
549|New Record Set for Qualifier Applications to 2024 Boston Marathon in First Year of Partnership with Bank of America|2684024|69|2023-09-15 21:40:58|2023-09-15|21:40:58
550|Achievements for Saturday, September 16, 2023|2684024|123|2023-09-16 04:01:15|2023-09-16|04:01:15
551|Official Q&amp;A for Saturday, September 16, 2023|2684024|164|2023-09-16 04:01:13|2023-09-16|04:01:13
553|The Weekend Thread — 15th September 2023|2684024|115|2023-09-15 11:58:01|2023-09-15|11:58:01
556|Achievements for Friday, September 15, 2023|2684024|67|2023-09-15 04:01:12|2023-09-15|04:01:12
557|Official Q&amp;A for Friday, September 15, 2023|2684024|152|2023-09-15 04:01:11|2023-09-15|04:01:11
559|I’m going to be a sweeper for the first time - any tips?|2684024|72|2023-09-13 19:46:03|2023-09-13|19:46:03
560|Anyone tried adidas marathon plan in the app?|2684024|7|2023-09-14 10:42:11|2023-09-14|10:42:11
561|Anyone ever tried having their Garmin train you for a race? How did that work out?|2684024|187|2023-09-13 14:25:24|2023-09-13|14:25:24
562|Mini 4-5 week block for NYC Marathon|2684024|6|2023-09-14 14:19:40|2023-09-14|14:19:40
563|Achievements for Thursday, September 14, 2023|2684024|44|2023-09-14 04:01:11|2023-09-14|04:01:11
564|New world record attempt in 24h race this weekend|2684024|62|2023-09-13 08:09:36|2023-09-13|08:09:36
565|Badly designed running shorts from brands that should know better: a polemic|2684024|154|2023-09-13 11:54:48|2023-09-13|11:54:48
566|Big Sur Lottery Commiseration Post|2684024|12|2023-09-14 03:25:34|2023-09-14|03:25:34
567|Official Q&amp;A for Thursday, September 14, 2023|2684024|215|2023-09-14 04:01:10|2023-09-14|04:01:10
568|Erie Marathon - September 10th, 2023|2684024|7|2023-09-13 14:23:54|2023-09-13|14:23:54
569|Achievements for Wednesday, September 13, 2023|2684024|40|2023-09-13 04:01:15|2023-09-13|04:01:15
572|Boston Marathon Acceptance Timeline|2684024|44|2023-09-12 13:19:57|2023-09-12|13:19:57
573|Nathan Firecatcher Alternative|2684024|2|2023-09-13 02:32:27|2023-09-13|02:32:27
574|Official Q&amp;A for Wednesday, September 13, 2023|2684024|224|2023-09-13 04:01:14|2023-09-13|04:01:14
575|Zone 2 vs Galloway|2684024|25|2023-09-12 12:51:40|2023-09-12|12:51:40
576|Do I Need A Running Plan?|2684024|144|2023-09-12 02:16:30|2023-09-12|02:16:30
577|Race report: Tallinn Half Marathon|2684024|5|2023-09-12 10:12:30|2023-09-12|10:12:30
580|Boom Gel Experiences|2684024|9|2023-09-12 00:19:45|2023-09-12|00:19:45
581|Official Q&amp;A for Tuesday, September 12, 2023|2684024|265|2023-09-12 04:01:10|2023-09-12|04:01:10
582|Race Report: Canmore Rocky Mountain Half Marathon|2684024|5|2023-09-11 18:18:58|2023-09-11|18:18:58
